{'factMap': {'T!T': {'rows': [{'dataCells': [{'label': '5/13/2019 12:31 AM', 'value': '2019-05-13T04:31:00Z'}, {'label': 'Yuhan Ko', 'value': '0051W000004MOkeQAG'}, {'label': 'PureCell 400 - 10125', 'value': 'a0T1W000005PCUxUAO'}, {'label': '00068778', 'value': '5001W00001Uz868QAB'}, {'label': 'CV000_STATUS - Fuel Valve Feedback', 'value': 'CV000_STATUS - Fuel Valve Feedback'}, {'label': 'Failed Start', 'value': 'Failed Start'}, {'label': 'Powerplant Induced Shutdown', 'value': 'Powerplant Induced Shutdown'}, {'label': '3,145', 'value': 3145}, {'label': '-', 'value': None}, {'label': '-', 'value': None}, {'label': '10125 KOSPO - CV000 SD', 'value': '5001W00001Uz868QAB'}, {'label': 'true', 'value': True}, {'label': 'false', 'value': False}, {'label': '-', 'value': None}, {'label': '10125 KOSPO - CV000 SD', 'value': '10125 KOSPO - CV000 SD'}]}, {'dataCells': [{'label': '5/12/2019 3:19 PM', 'value': '2019-05-12T19:19:00Z'}, {'label': 'Jaejoo Lim', 'value': '005400000033InGAAU'}, {'label': 'PureCell 400 - 10013', 'value': 'a0T40000005Nku8EAC'}, {'label': '00068742', 'value': '5001W00001Uz7VWQAZ'}, {'label': '<NORMAL_SHUTDOWN> - Normal Shutdown Signal from LOI', 'value': '<NORMAL_SHUTDOWN> - Normal Shutdown Signal from LOI'}, {'label': 'Outage', 'value': 'Outage'}, {'label': 'Powerplant Induced Shutdown', 'value': 'Powerplant Induced Shutdown'}, {'label': '10,121', 'value': 10121}, {'label': '-', 'value': None}, {'label': '-', 'value': None}, {'label': '10013 EWP - Manual SD to replace REF/ILS', 'value': '5001W00001Uz7VWQAZ'}, {'label': 'true', 'value': True}, {'label': 'false', 'value': False}, {'label': '-', 'value': None}, {'label': '10013 EWP - Manual SD to replace REF/ILS', 'value': '10013 EWP - Manual SD to replace REF/ILS'}]}, {'dataCells': [{'label': '5/12/2019 1:30 PM', 'value': '2019-05-12T17:30:00Z'}, {'label': 'Seungwoo Song', 'value': '0051W000004WiqaQAC'}, {'label': 'PureCell 400 - 10160', 'value': 'a0T1W000005tN1IUAU'}, {'label': '00068739', 'value': '5001W00001Uz7RyQAJ'}, {'label': 'LOR_STATUS (Note 7) - ECS Lockout Relay Status Signal', 'value': 'LOR_STATUS (Note 7) - ECS Lockout Relay Status Signal'}, {'label': 'Outage', 'value': 'Outage'}, {'label': 'Powerplant Induced Shutdown', 'value': 'Powerplant Induced Shutdown'}, {'label': '1,298', 'value': 1298}, {'label': '-', 'value': None}, {'label': '-', 'value': None}, {'label': '10160 West Power 3 - LOR SD', 'value': '5001W00001Uz7RyQAJ'}, {'label': 'true', 'value': True}, {'label': 'false', 'value': False}, {'label': '-', 'value': None}, {'label': '10160 West Power 3 - LOR SD', 'value': '10160 West Power 3 - LOR SD'}]}, {'dataCells': [{'label': '5/12/2019 9:28 AM', 'value': '2019-05-12T13:28:00Z'}, {'label': 'Justin Reynolds', 'value': '00540000001d3HZAAY'}, {'label': 'PureCell 400 - 9589', 'value': 'a0T40000001ltFCEAY'}, {'label': '00068738', 'value': '5001W00001Uz7HAQAZ'}, {'label': 'TE002FT - HDS Bed Outlet Temperature', 'value': 'TE002FT - HDS Bed Outlet Temperature'}, {'label': 'Outage', 'value': 'Outage'}, {'label': 'Powerplant Induced Shutdown', 'value': 'Powerplant Induced Shutdown'}, {'label': '0', 'value': 0}, {'label': '-', 'value': None}, {'label': '-', 'value': None}, {'label': '9589 Verizon - TE002 Shutdown', 'value': '5001W00001Uz7HAQAZ'}, {'label': 'true', 'value': True}, {'label': 'false', 'value': False}, {'label': '-', 'value': None}, {'label': 'No remote comms after TE002 shutdown alarm.  Unable to login to HMI.\r\n\r\n- TE002 is 197 at time of s/d\r\n- 17-0160 completed 4/9/18, no remote comms so unable to confirm that LSTATE Interlock TE001 is set to 300degC \r\n- AOUTHtr002A_C never gets above appx 34, so unable to determine the relationship between TE005 and HTR002A_C when above 80%. \r\n\r\nCheck that LSTATE Interlock TE001 set to 300degC (as called in retrofit 17-0160). \r\n1. If an issue with the ILS heater bands, Override HTR002 to 100% and measure current on all heater bands. Report to SE for further tshooting \r\n2. If heater bands OK, check for missing or wet insulation around the ILS \r\n3. Check that TE001, TE002 and TE005 are plugged into their correct cables. If not, fix cable issue, document NCM and continue tshooting. \r\n4. If all TEs plugged into correct cables, compare TE001, TE002 and TE005 handheld measurements and HMI. \r\n5. If not within 3degC, see procedure listed in FCM81489, Low TE002 Tab \r\n6. If within 3degC check ins...', 'value': 'No remote comms after TE002 shutdown alarm.  Unable to login to HMI.\r\n\r\n- TE002 is 197 at time of s/d\r\n- 17-0160 completed 4/9/18, no remote comms so unable to confirm that LSTATE Interlock TE001 is set to 300degC \r\n- AOUTHtr002A_C never gets above appx 34, so unable to determine the relationship between TE005 and HTR002A_C when above 80%. \r\n\r\nCheck that LSTATE Interlock TE001 set to 300degC (as called in retrofit 17-0160). \r\n1. If an issue with the ILS heater bands, Override HTR002 to 100% and measure current on all heater bands. Report to SE for further tshooting \r\n2. If heater bands OK, check for missing or wet insulation around the ILS \r\n3. Check that TE001, TE002 and TE005 are plugged into their correct cables. If not, fix cable issue, document NCM and continue tshooting. \r\n4. If all TEs plugged into correct cables, compare TE001, TE002 and TE005 handheld measurements and HMI. \r\n5. If not within 3degC, see procedure listed in FCM81489, Low TE002 Tab \r\n6. If within 3degC check ins...'}]}, {'dataCells': [{'label': '5/12/2019 5:10 AM', 'value': '2019-05-12T09:10:00Z'}, {'label': 'Yuhan Ko', 'value': '0051W000004MOkeQAG'}, {'label': 'PureCell 400 - 10161', 'value': 'a0T1W000005tN1JUAU'}, {'label': '00068729', 'value': '5001W00001Uz70iQAB'}, {'label': 'VDCTotal - Combined Stack Voltage < 690VDC', 'value': 'VDCTotal - Combined Stack Voltage < 690VDC'}, {'label': 'Outage', 'value': 'Outage'}, {'label': 'Powerplant Induced Shutdown', 'value': 'Powerplant Induced Shutdown'}, {'label': '3,972', 'value': 3972}, {'label': '-', 'value': None}, {'label': '-', 'value': None}, {'label': '10161 KOSPO - VDCTOTAL SD', 'value': '5001W00001Uz70iQAB'}, {'label': 'true', 'value': True}, {'label': 'false', 'value': False}, {'label': '-', 'value': None}, {'label': '10161 KOSPO - VDCTOTAL SD', 'value': '10161 KOSPO - VDCTOTAL SD'}]}, {'dataCells': [{'label': '5/12/2019 4:55 AM', 'value': '2019-05-12T08:55:00Z'}, {'label': 'Jaejoo Lim', 'value': '005400000033InGAAU'}, {'label': 'PureCell 400 - 9799', 'value': 'a0T40000004TyYXEA0'}, {'label': '00068728', 'value': '5001W00001Uz6zzQAB'}, {'label': 'LT450FT - Tank 450 Level (Fault Tolerant)', 'value': 'LT450FT - Tank 450 Level (Fault Tolerant)'}, {'label': 'Outage', 'value': 'Outage'}, {'label': 'Powerplant Induced Shutdown', 'value': 'Powerplant Induced Shutdown'}, {'label': '16,553', 'value': 16553}, {'label': '-', 'value': None}, {'label': '-', 'value': None}, {'label': '9799 Baegot - LT450FT SD', 'value': '5001W00001Uz6zzQAB'}, {'label': 'true', 'value': True}, {'label': 'false', 'value': False}, {'label': '-', 'value': None}, {'label': '9799 Baegot - LT450FT SD', 'value': '9799 Baegot - LT450FT SD'}]}, {'dataCells': [{'label': '5/12/2019 3:38 AM', 'value': '2019-05-12T07:38:00Z'}, {'label': 'Yuhan Ko', 'value': '0051W000004MOkeQAG'}, {'label': 'PureCell 400 - 10125', 'value': 'a0T1W000005PCUxUAO'}, {'label': '00068727', 'value': '5001W00001Uz6ppQAB'}, {'label': 'ZT010DEL - Ejector Position Fault', 'value': 'ZT010DEL - Ejector Position Fault'}, {'label': 'Outage', 'value': 'Outage'}, {'label': 'Powerplant Induced Shutdown', 'value': 'Powerplant Induced Shutdown'}, {'label': '3,145', 'value': 3145}, {'label': '5/13/2019 12:31 AM', 'value': '2019-05-13T04:31:00Z'}, {'label': '-', 'value': None}, {'label': '10125 KOSPO - ZT010Del SD', 'value': '5001W00001Uz6ppQAB'}, {'label': 'true', 'value': True}, {'label': 'false', 'value': False}, {'label': '-', 'value': None}, {'label': '10125 KOSPO - ZT010Del SD', 'value': '10125 KOSPO - ZT010Del SD'}]}, {'dataCells': [{'label': '5/12/2019 3:09 AM', 'value': '2019-05-12T07:09:00Z'}, {'label': 'Seungwoo Song', 'value': '0051W000004WiqaQAC'}, {'label': 'PureCell 400 - 9614', 'value': 'a0T40000003nbhIEAQ'}, {'label': '00068725', 'value': '5001W00001Uz6pLQAR'}, {'label': 'IP200 - Any PCS (Inverter) Shutdown', 'value': 'IP200 - Any PCS (Inverter) Shutdown'}, {'label': 'Outage', 'value': 'Outage'}, {'label': 'Powerplant Induced Shutdown', 'value': 'Powerplant Induced Shutdown'}, {'label': '37,766', 'value': 37766}, {'label': '-', 'value': None}, {'label': '-', 'value': None}, {'label': '9614 KOEN ANSAN - IP200SD(DC Under Voltage)', 'value': '5001W00001Uz6pLQAR'}, {'label': 'true', 'value': True}, {'label': 'false', 'value': False}, {'label': '-', 'value': None}, {'label': '9614 KOEN ANSAN - IP200SD(DC Under Voltage)', 'value': '9614 KOEN ANSAN - IP200SD(DC Under Voltage)'}]}, {'dataCells': [{'label': '5/12/2019 2:06 AM', 'value': '2019-05-12T06:06:00Z'}, {'label': 'Mooseung Choi', 'value': '0051W0000056xYsQAI'}, {'label': 'PureCell 400 - 9518', 'value': 'a0T40000001cWPvEAM'}, {'label': '00068721', 'value': '5001W00001Uz6o3QAB'}, {'label': 'LOR_STATUS (Note 7) - ECS Lockout Relay Status Signal', 'value': 'LOR_STATUS (Note 7) - ECS Lockout Relay Status Signal'}, {'label': 'Outage', 'value': 'Outage'}, {'label': 'Powerplant Induced Shutdown', 'value': 'Powerplant Induced Shutdown'}, {'label': '61,778', 'value': 61778}, {'label': '-', 'value': None}, {'label': '-', 'value': None}, {'label': '9518 GS Power - LORelay SD', 'value': '5001W00001Uz6o3QAB'}, {'label': 'true', 'value': True}, {'label': 'false', 'value': False}, {'label': '-', 'value': None}, {'label': '9518 GS Power - LORelay SD', 'value': '9518 GS Power - LORelay SD'}]}, {'dataCells': [{'label': '5/12/2019 1:51 AM', 'value': '2019-05-12T05:51:00Z'}, {'label': 'Kyounghoon Cho', 'value': '0054000000476RSAAY'}, {'label': 'PureCell 400 - 9631', 'value': 'a0T40000002PjXaEAK'}, {'label': '00068720', 'value': '5001W00001Uz6noQAB'}, {'label': 'VT310DELD - Half Stack Voltage Delta, Stack D', 'value': 'VT310DELD - Half Stack Voltage Delta, Stack D'}, {'label': 'Outage', 'value': 'Outage'}, {'label': 'Powerplant Induced Shutdown', 'value': 'Powerplant Induced Shutdown'}, {'label': '21,979', 'value': 21979}, {'label': '5/12/2019 11:27 PM', 'value': '2019-05-13T03:27:00Z'}, {'label': '-', 'value': None}, {'label': '9631 KOEN3 - VT310DelD SD', 'value': '5001W00001Uz6noQAB'}, {'label': 'true', 'value': True}, {'label': 'false', 'value': False}, {'label': '-', 'value': None}, {'label': '9631 KOEN3 - VT310DelD SD', 'value': '9631 KOEN3 - VT310DelD SD'}]}, {'dataCells': [{'label': '5/12/2019 12:49 AM', 'value': '2019-05-12T04:49:00Z'}, {'label': 'Minhee Kim', 'value': '0051W0000056xYnQAI'}, {'label': 'PureCell 400 - 9586', 'value': 'a0T40000001ltF9EAI'}, {'label': '00068718', 'value': '5001W00001Uz6mHQAR'}, {'label': 'IP200 - Any PCS (Inverter) Shutdown', 'value': 'IP200 - Any PCS (Inverter) Shutdown'}, {'label': 'Outage', 'value': 'Outage'}, {'label': 'Powerplant Induced Shutdown', 'value': 'Powerplant Induced Shutdown'}, {'label': '40,669', 'value': 40669}, {'label': '-', 'value': None}, {'label': '-', 'value': None}, {'label': '9586 KOEN2 - IP200SD(DC Under Voltage)', 'value': '5001W00001Uz6mHQAR'}, {'label': 'true', 'value': True}, {'label': 'false', 'value': False}, {'label': '-', 'value': None}, {'label': '9586 KOEN2 - IP200SD(DC Under Voltage)', 'value': '9586 KOEN2 - IP200SD(DC Under Voltage)'}]}, {'dataCells': [{'label': '5/11/2019 9:45 AM', 'value': '2019-05-11T13:45:00Z'}, {'label': 'Sinho Song', 'value': '00540000003dfQoAAI'}, {'label': 'PureCell 400 - 9702', 'value': 'a0T40000004TyWyEAK'}, {'label': '00068712', 'value': '5001W00001Uz65XQAR'}, {'label': 'IP200 - Any PCS (Inverter) Shutdown', 'value': 'IP200 - Any PCS (Inverter) Shutdown'}, {'label': 'Failed Start', 'value': 'Failed Start'}, {'label': 'Powerplant Induced Shutdown', 'value': 'Powerplant Induced Shutdown'}, {'label': '17,739', 'value': 17739}, {'label': '5/12/2019 1:52 AM', 'value': '2019-05-12T05:52:00Z'}, {'label': '-', 'value': None}, {'label': '9702 BGE -  IP200 SD (Under Power Fault)', 'value': '5001W00001Uz65XQAR'}, {'label': 'true', 'value': True}, {'label': 'false', 'value': False}, {'label': '-', 'value': None}, {'label': '9702 BGE -  IP200 SD (Under Power Fault)', 'value': '9702 BGE -  IP200 SD (Under Power Fault)'}]}, {'dataCells': [{'label': '5/11/2019 4:23 AM', 'value': '2019-05-11T08:23:00Z'}, {'label': 'Seungwoo Song', 'value': '0051W000004WiqaQAC'}, {'label': 'PureCell 400 - 9684', 'value': 'a0T40000002PjYREA0'}, {'label': '00068710', 'value': '5001W00001Uz5rVQAR'}, {'label': 'FT140 - Burner Air Flow Transmitter', 'value': 'FT140 - Burner Air Flow Transmitter'}, {'label': 'Failed Start', 'value': 'Failed Start'}, {'label': 'Powerplant Induced Shutdown', 'value': 'Powerplant Induced Shutdown'}, {'label': '18,395', 'value': 18395}, {'label': '5/12/2019 8:27 AM', 'value': '2019-05-12T12:27:00Z'}, {'label': '-', 'value': None}, {'label': '9684 West Power - FT140 SD', 'value': '5001W00001Uz5rVQAR'}, {'label': 'true', 'value': True}, {'label': 'false', 'value': False}, {'label': '-', 'value': None}, {'label': '9684 West Power - FT140 SD', 'value': '9684 West Power - FT140 SD'}]}, {'dataCells': [{'label': '5/11/2019 4:23 AM', 'value': '2019-05-11T08:23:00Z'}, {'label': 'Boram Kim', 'value': '0051W000004MOkdQAG'}, {'label': 'PureCell 400 - 10162', 'value': 'a0T1W000005tN1KUAU'}, {'label': '00068711', 'value': '5001W00001Uz5vcQAB'}, {'label': 'LOR_STATUS (Note 7) - ECS Lockout Relay Status Signal', 'value': 'LOR_STATUS (Note 7) - ECS Lockout Relay Status Signal'}, {'label': 'Outage', 'value': 'Outage'}, {'label': 'Powerplant Induced Shutdown', 'value': 'Powerplant Induced Shutdown'}, {'label': '917', 'value': 917}, {'label': '-', 'value': None}, {'label': '-', 'value': None}, {'label': '10162 WP3 - LORelay SD', 'value': '5001W00001Uz5vcQAB'}, {'label': 'true', 'value': True}, {'label': 'false', 'value': False}, {'label': '-', 'value': None}, {'label': '10162 WP3 - LORelay SD', 'value': '10162 WP3 - LORelay SD'}]}, {'dataCells': [{'label': '5/11/2019 1:15 AM', 'value': '2019-05-11T05:15:00Z'}, {'label': 'Mooseung Choi', 'value': '0051W0000056xYsQAI'}, {'label': 'PureCell 400 - 9512', 'value': 'a0T40000001cWOqEAM'}, {'label': '00068706', 'value': '5001W00001Uz5gXQAR'}, {'label': 'Burner_ER - Low Burner ER', 'value': 'Burner_ER - Low Burner ER'}, {'label': 'Outage', 'value': 'Outage'}, {'label': 'Powerplant Induced Shutdown', 'value': 'Powerplant Induced Shutdown'}, {'label': '50,625', 'value': 50625}, {'label': '5/11/2019 7:56 AM', 'value': '2019-05-11T11:56:00Z'}, {'label': '-', 'value': None}, {'label': '9512 GS Power - BurnerER SD', 'value': '5001W00001Uz5gXQAR'}, {'label': 'true', 'value': True}, {'label': 'false', 'value': False}, {'label': '-', 'value': None}, {'label': '9512 GS Power - BurnerER SD', 'value': '9512 GS Power - BurnerER SD'}]}, {'dataCells': [{'label': '5/11/2019 12:13 AM', 'value': '2019-05-11T04:13:00Z'}, {'label': 'Kyounghoon Cho', 'value': '0054000000476RSAAY'}, {'label': 'PureCell 400 - 10130', 'value': 'a0T1W000005PTVjUAO'}, {'label': '00068705', 'value': '5001W00001Uz5ebQAB'}, {'label': 'CV000_STATUS - Fuel Valve Feedback', 'value': 'CV000_STATUS - Fuel Valve Feedback'}, {'label': 'Outage', 'value': 'Outage'}, {'label': 'Powerplant Induced Shutdown', 'value': 'Powerplant Induced Shutdown'}, {'label': '4,144', 'value': 4144}, {'label': '-', 'value': None}, {'label': '-', 'value': None}, {'label': '10130 KDHC - CV000 SD', 'value': '5001W00001Uz5ebQAB'}, {'label': 'true', 'value': True}, {'label': 'false', 'value': False}, {'label': '-', 'value': None}, {'label': '10130 KDHC - CV000 SD', 'value': '10130 KDHC - CV000 SD'}]}, {'dataCells': [{'label': '5/10/2019 12:12 PM', 'value': '2019-05-10T16:12:00Z'}, {'label': 'Seungwoo Song', 'value': '0051W000004WiqaQAC'}, {'label': 'PureCell 400 - 9684', 'value': 'a0T40000002PjYREA0'}, {'label': '00068691', 'value': '5001W00001Uz26MQAR'}, {'label': 'FT012ERR - Fuel Flow Error', 'value': 'FT012ERR - Fuel Flow Error'}, {'label': 'Failed Start', 'value': 'Failed Start'}, {'label': 'Powerplant Induced Shutdown', 'value': 'Powerplant Induced Shutdown'}, {'label': '18,395', 'value': 18395}, {'label': '5/11/2019 4:23 AM', 'value': '2019-05-11T08:23:00Z'}, {'label': '-', 'value': None}, {'label': '9684 West Power - FT012errSD', 'value': '5001W00001Uz26MQAR'}, {'label': 'true', 'value': True}, {'label': 'false', 'value': False}, {'label': '-', 'value': None}, {'label': '9684 West Power - FT012errSD', 'value': '9684 West Power - FT012errSD'}]}, {'dataCells': [{'label': '5/10/2019 10:16 AM', 'value': '2019-05-10T14:16:00Z'}, {'label': 'Sinho Song', 'value': '00540000003dfQoAAI'}, {'label': 'PureCell 400 - 9747', 'value': 'a0T40000004TyXhEAK'}, {'label': '00068688', 'value': '5001W00001Uz0kyQAB'}, {'label': '<NORMAL_SHUTDOWN> - Normal Shutdown Signal from LOI', 'value': '<NORMAL_SHUTDOWN> - Normal Shutdown Signal from LOI'}, {'label': 'Failed Start', 'value': 'Failed Start'}, {'label': 'Powerplant Induced Shutdown', 'value': 'Powerplant Induced Shutdown'}, {'label': '15,847', 'value': 15847}, {'label': '5/11/2019 1:47 AM', 'value': '2019-05-11T05:47:00Z'}, {'label': '-', 'value': None}, {'label': '9747 BGE - Manual SD due to HTR400 Issue', 'value': '5001W00001Uz0kyQAB'}, {'label': 'true', 'value': True}, {'label': 'false', 'value': False}, {'label': '-', 'value': None}, {'label': '9747 BGE - Manual SD due to HTR400 Issue', 'value': '9747 BGE - Manual SD due to HTR400 Issue'}]}, {'dataCells': [{'label': '5/10/2019 8:38 AM', 'value': '2019-05-10T12:38:00Z'}, {'label': 'Jaejoo Lim', 'value': '005400000033InGAAU'}, {'label': 'PureCell 400 - 9513', 'value': 'a0T40000001cWPtEAM'}, {'label': '00068687', 'value': '5001W00001UyzzdQAB'}, {'label': 'P120SD - No Advancement From State P120', 'value': 'P120SD - No Advancement From State P120'}, {'label': 'Failed Start', 'value': 'Failed Start'}, {'label': 'Powerplant Induced Shutdown', 'value': 'Powerplant Induced Shutdown'}, {'label': '74,150', 'value': 74150}, {'label': '5/10/2019 11:51 PM', 'value': '2019-05-11T03:51:00Z'}, {'label': '-', 'value': None}, {'label': '9513 GS Power - P120SD', 'value': '5001W00001UyzzdQAB'}, {'label': 'true', 'value': True}, {'label': 'false', 'value': False}, {'label': '-', 'value': None}, {'label': '9513 GS Power - P120SD', 'value': '9513 GS Power - P120SD'}]}, {'dataCells': [{'label': '5/10/2019 6:21 AM', 'value': '2019-05-10T10:21:00Z'}, {'label': 'Sinho Song', 'value': '00540000003dfQoAAI'}, {'label': 'PureCell 400 - 9655', 'value': 'a0T40000002PjXyEAK'}, {'label': '00068685', 'value': '5001W00001UyzOrQAJ'}, {'label': 'AT160 - Combustibility Sensor', 'value': 'AT160 - Combustibility Sensor'}, {'label': 'Outage', 'value': 'Outage'}, {'label': 'Powerplant Induced Shutdown', 'value': 'Powerplant Induced Shutdown'}, {'label': '18,318', 'value': 18318}, {'label': '5/10/2019 11:02 AM', 'value': '2019-05-10T15:02:00Z'}, {'label': '-', 'value': None}, {'label': '9655 BGE - AT160 SD', 'value': '5001W00001UyzOrQAJ'}, {'label': 'true', 'value': True}, {'label': 'false', 'value': False}, {'label': '-', 'value': None}, {'label': '9655 BGE - AT160 SD', 'value': '9655 BGE - AT160 SD'}]}, {'dataCells': [{'label': '5/10/2019 4:40 AM', 'value': '2019-05-10T08:40:00Z'}, {'label': 'Jaejoo Lim', 'value': '005400000033InGAAU'}, {'label': 'PureCell 400 - 9794', 'value': 'a0T40000004TyYSEA0'}, {'label': '00068682', 'value': '5001W00001Uyz5VQAR'}, {'label': 'BC_SD - Burner Controller Shutdown', 'value': 'BC_SD - Burner Controller Shutdown'}, {'label': 'Failed Start', 'value': 'Failed Start'}, {'label': 'Powerplant Induced Shutdown', 'value': 'Powerplant Induced Shutdown'}, {'label': '15,891', 'value': 15891}, {'label': '-', 'value': None}, {'label': '-', 'value': None}, {'label': '9794 Baegot - BC SD', 'value': '5001W00001Uyz5VQAR'}, {'label': 'true', 'value': True}, {'label': 'false', 'value': False}, {'label': '-', 'value': None}, {'label': '9794 Baegot - BC SD', 'value': '9794 Baegot - BC SD'}]}, {'dataCells': [{'label': '5/10/2019 2:49 AM', 'value': '2019-05-10T06:49:00Z'}, {'label': 'Sinho Song', 'value': '00540000003dfQoAAI'}, {'label': 'PureCell 400 - 9782', 'value': 'a0T40000004TyYGEA0'}, {'label': '00068668', 'value': '5001W00001UyyV3QAJ'}, {'label': 'IP200 - Any PCS (Inverter) Shutdown', 'value': 'IP200 - Any PCS (Inverter) Shutdown'}, {'label': 'Failed Start', 'value': 'Failed Start'}, {'label': 'Powerplant Induced Shutdown', 'value': 'Powerplant Induced Shutdown'}, {'label': '6,351', 'value': 6351}, {'label': '5/10/2019 6:29 AM', 'value': '2019-05-10T10:29:00Z'}, {'label': '-', 'value': None}, {'label': '9782 KOEN4 -  IP200 SD (REDUNDANCY FAULT)', 'value': '5001W00001UyyV3QAJ'}, {'label': 'true', 'value': True}, {'label': 'false', 'value': False}, {'label': '-', 'value': None}, {'label': '9782 KOEN4 -  IP200 SD (REDUNDANCY FAULT)', 'value': '9782 KOEN4 -  IP200 SD (REDUNDANCY FAULT)'}]}, {'dataCells': [{'label': '5/10/2019 2:28 AM', 'value': '2019-05-10T06:28:00Z'}, {'label': 'Sinho Song', 'value': '00540000003dfQoAAI'}, {'label': 'PureCell 400 - 9747', 'value': 'a0T40000004TyXhEAK'}, {'label': '00068661', 'value': '5001W00001UyyRzQAJ'}, {'label': 'CV000_STATUS - Fuel Valve Feedback', 'value': 'CV000_STATUS - Fuel Valve Feedback'}, {'label': 'Outage', 'value': 'Outage'}, {'label': 'Powerplant Induced Shutdown', 'value': 'Powerplant Induced Shutdown'}, {'label': '15,848', 'value': 15848}, {'label': '5/10/2019 10:17 AM', 'value': '2019-05-10T14:17:00Z'}, {'label': '-', 'value': None}, {'label': '9747 BGE - CV000 SD', 'value': '5001W00001UyyRzQAJ'}, {'label': 'true', 'value': True}, {'label': 'false', 'value': False}, {'label': '-', 'value': None}, {'label': '9747 BGE - CV000 SD', 'value': '9747 BGE - CV000 SD'}]}, {'dataCells': [{'label': '5/10/2019 1:47 AM', 'value': '2019-05-10T05:47:00Z'}, {'label': 'Minhee Kim', 'value': '0051W0000056xYnQAI'}, {'label': 'PureCell 400 - 9590', 'value': 'a0T40000001ltFDEAY'}, {'label': '00068656', 'value': '5001W00001UyyLcQAJ'}, {'label': 'IP200 - Any PCS (Inverter) Shutdown', 'value': 'IP200 - Any PCS (Inverter) Shutdown'}, {'label': 'Outage', 'value': 'Outage'}, {'label': 'Powerplant Induced Shutdown', 'value': 'Powerplant Induced Shutdown'}, {'label': '39,313', 'value': 39313}, {'label': '5/10/2019 6:56 AM', 'value': '2019-05-10T10:56:00Z'}, {'label': '-', 'value': None}, {'label': '9590 KOEN2 - IP200SD(On Board Temp)', 'value': '5001W00001UyyLcQAJ'}, {'label': 'true', 'value': True}, {'label': 'false', 'value': False}, {'label': '-', 'value': None}, {'label': '9590 KOEN2 - IP200SD(On Board Temp)', 'value': '9590 KOEN2 - IP200SD(On Board Temp)'}]}, {'dataCells': [{'label': '5/10/2019 1:24 AM', 'value': '2019-05-10T05:24:00Z'}, {'label': 'Mooseung Choi', 'value': '0051W0000056xYsQAI'}, {'label': 'PureCell 400 - 9510', 'value': 'a0T40000001cWPpEAM'}, {'label': '00068650', 'value': '5001W00001UyyKKQAZ'}, {'label': 'IP200 - Any PCS (Inverter) Shutdown', 'value': 'IP200 - Any PCS (Inverter) Shutdown'}, {'label': 'Failed Start', 'value': 'Failed Start'}, {'label': 'Powerplant Induced Shutdown', 'value': 'Powerplant Induced Shutdown'}, {'label': '70,814', 'value': 70814}, {'label': '-', 'value': None}, {'label': '-', 'value': None}, {'label': '9510 GS Power - IP200 SD(MOVE Fuse Fault)', 'value': '5001W00001UyyKKQAZ'}, {'label': 'true', 'value': True}, {'label': 'false', 'value': False}, {'label': '-', 'value': None}, {'label': '9510 GS Power - IP200 SD(MOVE Fuse Fault)', 'value': '9510 GS Power - IP200 SD(MOVE Fuse Fault)'}]}, {'dataCells': [{'label': '5/10/2019 1:23 AM', 'value': '2019-05-10T05:23:00Z'}, {'label': 'Mooseung Choi', 'value': '0051W0000056xYsQAI'}, {'label': 'PureCell 400 - 9513', 'value': 'a0T40000001cWPtEAM'}, {'label': '00068655', 'value': '5001W00001UyyLXQAZ'}, {'label': 'IP200 - Any PCS (Inverter) Shutdown', 'value': 'IP200 - Any PCS (Inverter) Shutdown'}, {'label': 'Outage', 'value': 'Outage'}, {'label': 'Powerplant Induced Shutdown', 'value': 'Powerplant Induced Shutdown'}, {'label': '74,150', 'value': 74150}, {'label': '5/10/2019 8:38 AM', 'value': '2019-05-10T12:38:00Z'}, {'label': '-', 'value': None}, {'label': '9513 GS Power - IP200 SD(MOVE Fuse Fault)', 'value': '5001W00001UyyLXQAZ'}, {'label': 'true', 'value': True}, {'label': 'false', 'value': False}, {'label': '-', 'value': None}, {'label': '9513 GS Power - IP200 SD(MOVE Fuse Fault)', 'value': '9513 GS Power - IP200 SD(MOVE Fuse Fault)'}]}, {'dataCells': [{'label': '5/10/2019 1:23 AM', 'value': '2019-05-10T05:23:00Z'}, {'label': 'Mooseung Choi', 'value': '0051W0000056xYsQAI'}, {'label': 'PureCell 400 - 9511', 'value': 'a0T40000001cWPwEAM'}, {'label': '00068651', 'value': '5001W00001UyyKeQAJ'}, {'label': 'IP200 - Any PCS (Inverter) Shutdown', 'value': 'IP200 - Any PCS (Inverter) Shutdown'}, {'label': 'Outage', 'value': 'Outage'}, {'label': 'Powerplant Induced Shutdown', 'value': 'Powerplant Induced Shutdown'}, {'label': '46,961', 'value': 46961}, {'label': '5/10/2019 10:29 AM', 'value': '2019-05-10T14:29:00Z'}, {'label': '-', 'value': None}, {'label': '9511 GS Power - IP200 SD(MOVE Fuse Fault)', 'value': '5001W00001UyyKeQAJ'}, {'label': 'true', 'value': True}, {'label': 'false', 'value': False}, {'label': '-', 'value': None}, {'label': '9511 GS Power - IP200 SD(MOVE Fuse Fault)', 'value': '9511 GS Power - IP200 SD(MOVE Fuse Fault)'}]}, {'dataCells': [{'label': '5/10/2019 1:23 AM', 'value': '2019-05-10T05:23:00Z'}, {'label': 'Mooseung Choi', 'value': '0051W0000056xYsQAI'}, {'label': 'PureCell 400 - 9512', 'value': 'a0T40000001cWOqEAM'}, {'label': '00068652', 'value': '5001W00001UyyKtQAJ'}, {'label': 'IP200 - Any PCS (Inverter) Shutdown', 'value': 'IP200 - Any PCS (Inverter) Shutdown'}, {'label': 'Outage', 'value': 'Outage'}, {'label': 'Powerplant Induced Shutdown', 'value': 'Powerplant Induced Shutdown'}, {'label': '50,768', 'value': 50768}, {'label': '5/10/2019 9:09 AM', 'value': '2019-05-10T13:09:00Z'}, {'label': '-', 'value': None}, {'label': '9512 GS Power - IP200 SD(MOVE Fuse Fault)', 'value': '5001W00001UyyKtQAJ'}, {'label': 'true', 'value': True}, {'label': 'false', 'value': False}, {'label': '-', 'value': None}, {'label': '9512 GS Power - IP200 SD(MOVE Fuse Fault)', 'value': '9512 GS Power - IP200 SD(MOVE Fuse Fault)'}]}, {'dataCells': [{'label': '5/10/2019 1:23 AM', 'value': '2019-05-10T05:23:00Z'}, {'label': 'Mooseung Choi', 'value': '0051W0000056xYsQAI'}, {'label': 'PureCell 400 - 9509', 'value': 'a0T40000001cWPrEAM'}, {'label': '00068649', 'value': '5001W00001UyyK0QAJ'}, {'label': 'IP200 - Any PCS (Inverter) Shutdown', 'value': 'IP200 - Any PCS (Inverter) Shutdown'}, {'label': 'Outage', 'value': 'Outage'}, {'label': 'Powerplant Induced Shutdown', 'value': 'Powerplant Induced Shutdown'}, {'label': '49,989', 'value': 49989}, {'label': '5/10/2019 9:24 AM', 'value': '2019-05-10T13:24:00Z'}, {'label': '-', 'value': None}, {'label': '9509 GS Power - IP200 SD(MOVE Fuse Fault)', 'value': '5001W00001UyyK0QAJ'}, {'label': 'true', 'value': True}, {'label': 'false', 'value': False}, {'label': '-', 'value': None}, {'label': '9509 GS Power - IP200 SD(MOVE Fuse Fault)', 'value': '9509 GS Power - IP200 SD(MOVE Fuse Fault)'}]}, {'dataCells': [{'label': '5/10/2019 1:23 AM', 'value': '2019-05-10T05:23:00Z'}, {'label': 'Mooseung Choi', 'value': '0051W0000056xYsQAI'}, {'label': 'PureCell 400 - 9514', 'value': 'a0T40000001cWPqEAM'}, {'label': '00068657', 'value': '5001W00001UyyMaQAJ'}, {'label': 'IP200 - Any PCS (Inverter) Shutdown', 'value': 'IP200 - Any PCS (Inverter) Shutdown'}, {'label': 'Outage', 'value': 'Outage'}, {'label': 'Powerplant Induced Shutdown', 'value': 'Powerplant Induced Shutdown'}, {'label': '45,906', 'value': 45906}, {'label': '5/10/2019 8:09 AM', 'value': '2019-05-10T12:09:00Z'}, {'label': '-', 'value': None}, {'label': '9514 GS Power - IP200 SD(MOVE Fuse Fault)', 'value': '5001W00001UyyMaQAJ'}, {'label': 'true', 'value': True}, {'label': 'false', 'value': False}, {'label': '-', 'value': None}, {'label': '9514 GS Power - IP200 SD(MOVE Fuse Fault)', 'value': '9514 GS Power - IP200 SD(MOVE Fuse Fault)'}]}, {'dataCells': [{'label': '5/10/2019 1:22 AM', 'value': '2019-05-10T05:22:00Z'}, {'label': 'Sinho Song', 'value': '00540000003dfQoAAI'}, {'label': 'PureCell 400 - 10040', 'value': 'a0T40000005NkuZEAS'}, {'label': '00068648', 'value': '5001W00001UyyI4QAJ'}, {'label': 'IP200 - Any PCS (Inverter) Shutdown', 'value': 'IP200 - Any PCS (Inverter) Shutdown'}, {'label': 'Outage', 'value': 'Outage'}, {'label': 'Powerplant Induced Shutdown', 'value': 'Powerplant Induced Shutdown'}, {'label': '5,504', 'value': 5504}, {'label': '5/10/2019 10:28 AM', 'value': '2019-05-10T14:28:00Z'}, {'label': '-', 'value': None}, {'label': '10040 KOEN4 - BC SD', 'value': '5001W00001UyyI4QAJ'}, {'label': 'true', 'value': True}, {'label': 'false', 'value': False}, {'label': '-', 'value': None}, {'label': '10040 KOEN4 - BC SD', 'value': '10040 KOEN4 - BC SD'}]}, {'dataCells': [{'label': '5/9/2019 9:39 PM', 'value': '2019-05-10T01:39:00Z'}, {'label': 'Kyounghoon Cho', 'value': '0054000000476RSAAY'}, {'label': 'PureCell 400 - 9592', 'value': 'a0T40000001ltFFEAY'}, {'label': '00068639', 'value': '5001W00001UyxsBQAR'}, {'label': 'IP200 - Any PCS (Inverter) Shutdown', 'value': 'IP200 - Any PCS (Inverter) Shutdown'}, {'label': 'Outage', 'value': 'Outage'}, {'label': 'Powerplant Induced Shutdown', 'value': 'Powerplant Induced Shutdown'}, {'label': '120', 'value': 120}, {'label': '5/10/2019 4:14 AM', 'value': '2019-05-10T08:14:00Z'}, {'label': '-', 'value': None}, {'label': '9592 LOTTE - IP200SD(On Board Temp)', 'value': '5001W00001UyxsBQAR'}, {'label': 'true', 'value': True}, {'label': 'false', 'value': False}, {'label': '-', 'value': None}, {'label': '9592 LOTTE - IP200SD(On Board Temp)', 'value': '9592 LOTTE - IP200SD(On Board Temp)'}]}, {'dataCells': [{'label': '5/9/2019 8:16 PM', 'value': '2019-05-10T00:16:00Z'}, {'label': 'Jaejoo Lim', 'value': '005400000033InGAAU'}, {'label': 'PureCell 400 - 10011', 'value': 'a0T40000005Nku6EAC'}, {'label': '00068636', 'value': '5001W00001UyxhrQAB'}, {'label': 'ZT010DEL - Ejector Position Fault', 'value': 'ZT010DEL - Ejector Position Fault'}, {'label': 'Outage', 'value': 'Outage'}, {'label': 'Powerplant Induced Shutdown', 'value': 'Powerplant Induced Shutdown'}, {'label': '9,867', 'value': 9867}, {'label': '5/10/2019 1:32 AM', 'value': '2019-05-10T05:32:00Z'}, {'label': '-', 'value': None}, {'label': '10011 EWP - ZT010Del SD', 'value': '5001W00001UyxhrQAB'}, {'label': 'true', 'value': True}, {'label': 'false', 'value': False}, {'label': '-', 'value': None}, {'label': '10011 EWP - ZT010Del SD\r\n\r\n* FCV500 position opened 85%, but ZT010 changed from 85% to 10%.\r\n* TE012FT/PT510/PT012 was steady, so i suspected ZT010 was a issue.', 'value': '10011 EWP - ZT010Del SD\r\n\r\n* FCV500 position opened 85%, but ZT010 changed from 85% to 10%.\r\n* TE012FT/PT510/PT012 was steady, so i suspected ZT010 was a issue.'}]}, {'dataCells': [{'label': '5/9/2019 7:53 PM', 'value': '2019-05-09T23:53:00Z'}, {'label': 'Boram Kim', 'value': '0051W000004MOkdQAG'}, {'label': 'PureCell 400 - 10150', 'value': 'a0T1W000005PfktUAC'}, {'label': '00068637', 'value': '5001W00001Uyxl5QAB'}, {'label': 'IP200 - Any PCS (Inverter) Shutdown', 'value': 'IP200 - Any PCS (Inverter) Shutdown'}, {'label': 'Outage', 'value': 'Outage'}, {'label': 'Powerplant Induced Shutdown', 'value': 'Powerplant Induced Shutdown'}, {'label': '1,159', 'value': 1159}, {'label': '5/10/2019 1:43 AM', 'value': '2019-05-10T05:43:00Z'}, {'label': '-', 'value': None}, {'label': '10150 WP3 - IP200 (PEBB temp unbalance) SD', 'value': '5001W00001Uyxl5QAB'}, {'label': 'true', 'value': True}, {'label': 'false', 'value': False}, {'label': '-', 'value': None}, {'label': '10150 WP3 - IP200 (PEBB temp unbalance) SD', 'value': '10150 WP3 - IP200 (PEBB temp unbalance) SD'}]}, {'dataCells': [{'label': '5/9/2019 5:54 PM', 'value': '2019-05-09T21:54:00Z'}, {'label': 'Jaejoo Lim', 'value': '005400000033InGAAU'}, {'label': 'PureCell 400 - 9517', 'value': 'a0T40000001cWPsEAM'}, {'label': '00068631', 'value': '5001W00001Uyx7jQAB'}, {'label': 'LT435 (Note 9) - Wet Scrubber Water Tank Level Transmitter', 'value': 'LT435 (Note 9) - Wet Scrubber Water Tank Level Transmitter'}, {'label': 'Outage', 'value': 'Outage'}, {'label': 'Powerplant Induced Shutdown', 'value': 'Powerplant Induced Shutdown'}, {'label': '70,254', 'value': 70254}, {'label': '5/10/2019 6:10 AM', 'value': '2019-05-10T10:10:00Z'}, {'label': '-', 'value': None}, {'label': '9517 GS Power - LT435 SD', 'value': '5001W00001Uyx7jQAB'}, {'label': 'true', 'value': True}, {'label': 'false', 'value': False}, {'label': '-', 'value': None}, {'label': '9517 GS Power - LT435 SD', 'value': '9517 GS Power - LT435 SD'}]}, {'dataCells': [{'label': '5/9/2019 5:58 AM', 'value': '2019-05-09T09:58:00Z'}, {'label': 'Justin Reynolds', 'value': '00540000001d3HZAAY'}, {'label': 'PureCell 400 - 9675', 'value': 'a0T40000002PjYIEA0'}, {'label': '00068615', 'value': '5001W00001Uyr58QAB'}, {'label': '<Shutdown> - Shutdown from Operations Display (ET)', 'value': '<Shutdown> - Shutdown from Operations Display (ET)'}, {'label': 'Outage', 'value': 'Outage'}, {'label': 'Powerplant Induced Shutdown', 'value': 'Powerplant Induced Shutdown'}, {'label': '18,655', 'value': 18655}, {'label': '5/10/2019 1:18 AM', 'value': '2019-05-10T05:18:00Z'}, {'label': '-', 'value': None}, {'label': '9675 ECSU - Manual Shutdown', 'value': '5001W00001Uyr58QAB'}, {'label': 'true', 'value': True}, {'label': 'false', 'value': False}, {'label': '-', 'value': None}, {'label': '9675 ECSU - Manual Shutdown (Stack Replacement)', 'value': '9675 ECSU - Manual Shutdown (Stack Replacement)'}]}, {'dataCells': [{'label': '5/9/2019 5:19 AM', 'value': '2019-05-09T09:19:00Z'}, {'label': 'Mooseung Choi', 'value': '0051W0000056xYsQAI'}, {'label': 'PureCell 400 - 9510', 'value': 'a0T40000001cWPpEAM'}, {'label': '00068616', 'value': '5001W00001UyrBVQAZ'}, {'label': 'IP200 - Any PCS (Inverter) Shutdown', 'value': 'IP200 - Any PCS (Inverter) Shutdown'}, {'label': 'Failed Start', 'value': 'Failed Start'}, {'label': 'Powerplant Induced Shutdown', 'value': 'Powerplant Induced Shutdown'}, {'label': '70,814', 'value': 70814}, {'label': '5/10/2019 1:24 AM', 'value': '2019-05-10T05:24:00Z'}, {'label': '-', 'value': None}, {'label': '9510 GS Power - IP200 SD (DC Under Voltage)', 'value': '5001W00001UyrBVQAZ'}, {'label': 'true', 'value': True}, {'label': 'false', 'value': False}, {'label': '-', 'value': None}, {'label': '9510 GS Power - IP200 SD (DC Under Voltage)', 'value': '9510 GS Power - IP200 SD (DC Under Voltage)'}]}, {'dataCells': [{'label': '5/9/2019 2:34 AM', 'value': '2019-05-09T06:34:00Z'}, {'label': 'Jinhee Na', 'value': '0051W000003rZIsQAM'}, {'label': 'PureCell 400 - 10025', 'value': 'a0T40000005NkuKEAS'}, {'label': '00068607', 'value': '5001W00001UyqUHQAZ'}, {'label': 'IP200 - Any PCS (Inverter) Shutdown', 'value': 'IP200 - Any PCS (Inverter) Shutdown'}, {'label': 'Outage', 'value': 'Outage'}, {'label': 'Powerplant Induced Shutdown', 'value': 'Powerplant Induced Shutdown'}, {'label': '9,183', 'value': 9183}, {'label': '5/9/2019 4:56 AM', 'value': '2019-05-09T08:56:00Z'}, {'label': '-', 'value': None}, {'label': '10025 EWP - IP200 SD (PCS100 RTU COMM Fault)', 'value': '5001W00001UyqUHQAZ'}, {'label': 'true', 'value': True}, {'label': 'false', 'value': False}, {'label': '-', 'value': None}, {'label': '10025 EWP - IP200 SD (PCS100 RTU COMM Fault)', 'value': '10025 EWP - IP200 SD (PCS100 RTU COMM Fault)'}]}, {'dataCells': [{'label': '5/9/2019 2:25 AM', 'value': '2019-05-09T06:25:00Z'}, {'label': 'Jaejoo Lim', 'value': '005400000033InGAAU'}, {'label': 'PureCell 400 - 9807', 'value': 'a0T40000003DsGZEA0'}, {'label': '00068606', 'value': '5001W00001UyqSaQAJ'}, {'label': 'TE400FT - Separator Temp Fault Tolerant - Output', 'value': 'TE400FT - Separator Temp Fault Tolerant - Output'}, {'label': 'Outage', 'value': 'Outage'}, {'label': 'Powerplant Induced Shutdown', 'value': 'Powerplant Induced Shutdown'}, {'label': '12,637', 'value': 12637}, {'label': '5/9/2019 6:15 AM', 'value': '2019-05-09T10:15:00Z'}, {'label': '-', 'value': None}, {'label': '9807 Baegot - TE400FT SD', 'value': '5001W00001UyqSaQAJ'}, {'label': 'true', 'value': True}, {'label': 'false', 'value': False}, {'label': '-', 'value': None}, {'label': '9807 Baegot - TE400FT SD', 'value': '9807 Baegot - TE400FT SD'}]}, {'dataCells': [{'label': '5/9/2019 1:57 AM', 'value': '2019-05-09T05:57:00Z'}, {'label': 'Boram Kim', 'value': '0051W000004MOkdQAG'}, {'label': 'PureCell 400 - 10171', 'value': 'a0T1W000005tN1TUAU'}, {'label': '00068603', 'value': '5001W00001UyqOnQAJ'}, {'label': 'VDCTotal - Combined Stack Voltage < 690VDC', 'value': 'VDCTotal - Combined Stack Voltage < 690VDC'}, {'label': 'Outage', 'value': 'Outage'}, {'label': 'Powerplant Induced Shutdown', 'value': 'Powerplant Induced Shutdown'}, {'label': '1,620', 'value': 1620}, {'label': '5/9/2019 7:56 AM', 'value': '2019-05-09T11:56:00Z'}, {'label': '-', 'value': None}, {'label': '10171 West Power 3 - VDCTOT SD', 'value': '5001W00001UyqOnQAJ'}, {'label': 'true', 'value': True}, {'label': 'false', 'value': False}, {'label': '-', 'value': None}, {'label': '10171 West Power 3 - VDCTOT SD', 'value': '10171 West Power 3 - VDCTOT SD'}]}, {'dataCells': [{'label': '5/9/2019 1:31 AM', 'value': '2019-05-09T05:31:00Z'}, {'label': 'Jaejoo Lim', 'value': '005400000033InGAAU'}, {'label': 'PureCell 400 - 9794', 'value': 'a0T40000004TyYSEA0'}, {'label': '00068602', 'value': '5001W00001UyqO4QAJ'}, {'label': 'BC_SD - Burner Controller Shutdown', 'value': 'BC_SD - Burner Controller Shutdown'}, {'label': 'Failed Start', 'value': 'Failed Start'}, {'label': 'Powerplant Induced Shutdown', 'value': 'Powerplant Induced Shutdown'}, {'label': '15,891', 'value': 15891}, {'label': '5/10/2019 4:40 AM', 'value': '2019-05-10T08:40:00Z'}, {'label': '-', 'value': None}, {'label': '9794 Baegot - BC SD', 'value': '5001W00001UyqO4QAJ'}, {'label': 'true', 'value': True}, {'label': 'false', 'value': False}, {'label': '-', 'value': None}, {'label': '9794 Baegot - BC SD', 'value': '9794 Baegot - BC SD'}]}, {'dataCells': [{'label': '5/9/2019 1:19 AM', 'value': '2019-05-09T05:19:00Z'}, {'label': 'Hyemi Ahn', 'value': '0051W0000056xYiQAI'}, {'label': 'PureCell 400 - 10002', 'value': 'a0T40000005NktxEAC'}, {'label': '00068601', 'value': '5001W00001UyqLFQAZ'}, {'label': 'LT400 - Separator Level Transmitter', 'value': 'LT400 - Separator Level Transmitter'}, {'label': 'Outage', 'value': 'Outage'}, {'label': 'Powerplant Induced Shutdown', 'value': 'Powerplant Induced Shutdown'}, {'label': '6,832', 'value': 6832}, {'label': '-', 'value': None}, {'label': 'FCV500', 'value': 'FCV500'}, {'label': '10002 KOEN 4 - LT400 SD', 'value': '5001W00001UyqLFQAZ'}, {'label': 'false', 'value': False}, {'label': 'true', 'value': True}, {'label': 'Before SD PT510 ramped up so need to check FCV500 operation with monitoring ZT010 value on HMI.', 'value': 'Before SD PT510 ramped up so need to check FCV500 operation with monitoring ZT010 value on HMI.'}, {'label': '10002 KOEN 4 - LT400 SD', 'value': '10002 KOEN 4 - LT400 SD'}]}, {'dataCells': [{'label': '5/9/2019 12:30 AM', 'value': '2019-05-09T04:30:00Z'}, {'label': 'Jinhee Na', 'value': '0051W000003rZIsQAM'}, {'label': 'PureCell 400 - 9843', 'value': 'a0T40000005NktkEAC'}, {'label': '00068598', 'value': '5001W00001UyqFlQAJ'}, {'label': 'FT140 - Burner Air Flow Transmitter', 'value': 'FT140 - Burner Air Flow Transmitter'}, {'label': 'Failed Start', 'value': 'Failed Start'}, {'label': 'Powerplant Induced Shutdown', 'value': 'Powerplant Induced Shutdown'}, {'label': '3,074', 'value': 3074}, {'label': '5/9/2019 6:03 AM', 'value': '2019-05-09T10:03:00Z'}, {'label': '-', 'value': None}, {'label': '9843 PTES - FT140 SD', 'value': '5001W00001UyqFlQAJ'}, {'label': 'true', 'value': True}, {'label': 'false', 'value': False}, {'label': '-', 'value': None}, {'label': '9843 PTES - FT140 SD\r\n\r\n* FT140 shaked because of FT140 non-linear schedule.', 'value': '9843 PTES - FT140 SD\r\n\r\n* FT140 shaked because of FT140 non-linear schedule.'}]}, {'dataCells': [{'label': '5/8/2019 11:06 PM', 'value': '2019-05-09T03:06:00Z'}, {'label': 'Mooseung Choi', 'value': '0051W0000056xYsQAI'}, {'label': 'PureCell 400 - 9510', 'value': 'a0T40000001cWPpEAM'}, {'label': '00068597', 'value': '5001W00001Uyq6KQAR'}, {'label': 'IP200 - Any PCS (Inverter) Shutdown', 'value': 'IP200 - Any PCS (Inverter) Shutdown'}, {'label': 'Failed Start', 'value': 'Failed Start'}, {'label': 'Powerplant Induced Shutdown', 'value': 'Powerplant Induced Shutdown'}, {'label': '70,814', 'value': 70814}, {'label': '5/9/2019 5:19 AM', 'value': '2019-05-09T09:19:00Z'}, {'label': 'VSD110', 'value': 'VSD110'}, {'label': '9510 GS Power - IP200 SD (DC Under Voltage)', 'value': '5001W00001Uyq6KQAR'}, {'label': 'false', 'value': False}, {'label': 'true', 'value': True}, {'label': 'BLO110 was not operated before SD\r\nClean the VSD110 Cooling FAN', 'value': 'BLO110 was not operated before SD\r\nClean the VSD110 Cooling FAN'}, {'label': '9510 GS Power - IP200 SD (DC Under Voltage)', 'value': '9510 GS Power - IP200 SD (DC Under Voltage)'}]}, {'dataCells': [{'label': '5/8/2019 6:10 PM', 'value': '2019-05-08T22:10:00Z'}, {'label': 'Sinho Song', 'value': '00540000003dfQoAAI'}, {'label': 'PureCell 400 - 9753', 'value': 'a0T40000004TyXnEAK'}, {'label': '00068576', 'value': '5001W00001UyoslQAB'}, {'label': 'IP200 - Any PCS (Inverter) Shutdown', 'value': 'IP200 - Any PCS (Inverter) Shutdown'}, {'label': 'Outage', 'value': 'Outage'}, {'label': 'Powerplant Induced Shutdown', 'value': 'Powerplant Induced Shutdown'}, {'label': '15,831', 'value': 15831}, {'label': '5/9/2019 12:43 AM', 'value': '2019-05-09T04:43:00Z'}, {'label': '-', 'value': None}, {'label': '9753 BGE - IP200 SD (LOR)', 'value': '5001W00001UyoslQAB'}, {'label': 'true', 'value': True}, {'label': 'false', 'value': False}, {'label': '-', 'value': None}, {'label': '9753 BGE - IP200 SD (LOR)', 'value': '9753 BGE - IP200 SD (LOR)'}]}, {'dataCells': [{'label': '5/8/2019 2:01 PM', 'value': '2019-05-08T18:01:00Z'}, {'label': 'Jinhee Na', 'value': '0051W000003rZIsQAM'}, {'label': 'PureCell 400 - 9843', 'value': 'a0T40000005NktkEAC'}, {'label': '00068571', 'value': '5001W00001UymX2QAJ'}, {'label': 'LOR_STATUS (Note 7) - ECS Lockout Relay Status Signal', 'value': 'LOR_STATUS (Note 7) - ECS Lockout Relay Status Signal'}, {'label': 'Outage', 'value': 'Outage'}, {'label': 'Powerplant Induced Shutdown', 'value': 'Powerplant Induced Shutdown'}, {'label': '3,073', 'value': 3073}, {'label': '-', 'value': None}, {'label': 'Indeterminate', 'value': 'Indeterminate'}, {'label': '9843 PTES 2 - LOR SD', 'value': '5001W00001UymX2QAJ'}, {'label': 'false', 'value': False}, {'label': 'true', 'value': True}, {'label': 'Calibrated and inspected AT160', 'value': 'Calibrated and inspected AT160'}, {'label': '9843 PTES 2 - LOR SD\r\n\r\n* AT160 changed from 0 to -24. \r\n* VSD110, 451, 800, 150, 151 fault occurred.', 'value': '9843 PTES 2 - LOR SD\r\n\r\n* AT160 changed from 0 to -24. \r\n* VSD110, 451, 800, 150, 151 fault occurred.'}]}, {'dataCells': [{'label': '5/8/2019 7:12 AM', 'value': '2019-05-08T11:12:00Z'}, {'label': 'Sinho Song', 'value': '00540000003dfQoAAI'}, {'label': 'PureCell 400 - 10002', 'value': 'a0T40000005NktxEAC'}, {'label': '00068565', 'value': '5001W00001Uyj2kQAB'}, {'label': 'TE012FT - Reformer Tube Temperature  Fault Tolerant Output', 'value': 'TE012FT - Reformer Tube Temperature  Fault Tolerant Output'}, {'label': 'Failed Start', 'value': 'Failed Start'}, {'label': 'Powerplant Induced Shutdown', 'value': 'Powerplant Induced Shutdown'}, {'label': '6,830', 'value': 6830}, {'label': '5/9/2019 12:28 AM', 'value': '2019-05-09T04:28:00Z'}, {'label': 'New (please add description in comments)', 'value': 'New (please add description in comments)'}, {'label': '10002 KOEN 4 -TE012FT SD', 'value': '5001W00001Uyj2kQAB'}, {'label': 'false', 'value': False}, {'label': 'true', 'value': True}, {'label': 'Adjusted ramp rate during burner ligh test', 'value': 'Adjusted ramp rate during burner ligh test'}, {'label': '10002 KOEN 4 -TE012FT SD', 'value': '10002 KOEN 4 -TE012FT SD'}]}, {'dataCells': [{'label': '5/8/2019 6:05 AM', 'value': '2019-05-08T10:05:00Z'}, {'label': 'Yuhan Ko', 'value': '0051W000004MOkeQAG'}, {'label': 'PureCell 400 - 10143', 'value': 'a0T1W000005PfkmUAC'}, {'label': '00068563', 'value': '5001W00001UyioEQAR'}, {'label': 'FT140 - Burner Air Flow Transmitter', 'value': 'FT140 - Burner Air Flow Transmitter'}, {'label': 'Failed Start', 'value': 'Failed Start'}, {'label': 'Powerplant Induced Shutdown', 'value': 'Powerplant Induced Shutdown'}, {'label': '2,538', 'value': 2538}, {'label': '5/8/2019 10:50 PM', 'value': '2019-05-09T02:50:00Z'}, {'label': 'VSD140', 'value': 'VSD140'}, {'label': '10143 KOSPO - FT140 SD', 'value': '5001W00001UyioEQAR'}, {'label': 'true', 'value': True}, {'label': 'false', 'value': False}, {'label': 'VSD140 was malfunction.', 'value': 'VSD140 was malfunction.'}, {'label': '10143 KOSPO - FT140 SD', 'value': '10143 KOSPO - FT140 SD'}]}, {'dataCells': [{'label': '5/8/2019 5:41 AM', 'value': '2019-05-08T09:41:00Z'}, {'label': 'Mooseung Choi', 'value': '0051W0000056xYsQAI'}, {'label': 'PureCell 400 - 9510', 'value': 'a0T40000001cWPpEAM'}, {'label': '00068562', 'value': '5001W00001UyihDQAR'}, {'label': 'LOR_STATUS (Note 7) - ECS Lockout Relay Status Signal', 'value': 'LOR_STATUS (Note 7) - ECS Lockout Relay Status Signal'}, {'label': 'Failed Start', 'value': 'Failed Start'}, {'label': 'Powerplant Induced Shutdown', 'value': 'Powerplant Induced Shutdown'}, {'label': '70,814', 'value': 70814}, {'label': '5/8/2019 11:06 PM', 'value': '2019-05-09T03:06:00Z'}, {'label': 'No Fault Found', 'value': 'No Fault Found'}, {'label': '9510 GS Power - LOR SD', 'value': '5001W00001UyihDQAR'}, {'label': 'false', 'value': False}, {'label': 'true', 'value': True}, {'label': 'check the BLO110', 'value': 'check the BLO110'}, {'label': '9510 GS Power - LOR SD', 'value': '9510 GS Power - LOR SD'}]}, {'dataCells': [{'label': '5/8/2019 4:39 AM', 'value': '2019-05-08T08:39:00Z'}, {'label': 'Minhee Kim', 'value': '0051W0000056xYnQAI'}, {'label': 'PureCell 400 - 9593', 'value': 'a0T40000001ltFGEAY'}, {'label': '00068557', 'value': '5001W00001UyiPnQAJ'}, {'label': 'TE012FT - Reformer Tube Temperature  Fault Tolerant Output', 'value': 'TE012FT - Reformer Tube Temperature  Fault Tolerant Output'}, {'label': 'Failed Start', 'value': 'Failed Start'}, {'label': 'Powerplant Induced Shutdown', 'value': 'Powerplant Induced Shutdown'}, {'label': '21,855', 'value': 21855}, {'label': '5/9/2019 2:46 AM', 'value': '2019-05-09T06:46:00Z'}, {'label': '-', 'value': None}, {'label': '9593 Lotte - TE012FT SD', 'value': '5001W00001UyiPnQAJ'}, {'label': 'true', 'value': True}, {'label': 'false', 'value': False}, {'label': '-', 'value': None}, {'label': '9593 Lotte - TE012FT SD', 'value': '9593 Lotte - TE012FT SD'}]}, {'dataCells': [{'label': '5/8/2019 4:32 AM', 'value': '2019-05-08T08:32:00Z'}, {'label': 'Rodolphe Rivaux', 'value': '0051W000003et3CQAQ'}, {'label': 'PureCell 400 - 9515', 'value': 'a0T40000001cWOrEAM'}, {'label': '00068560', 'value': '5001W00001UyiTBQAZ'}, {'label': 'IP200 - Any PCS (Inverter) Shutdown', 'value': 'IP200 - Any PCS (Inverter) Shutdown'}, {'label': 'Outage', 'value': 'Outage'}, {'label': 'Powerplant Induced Shutdown', 'value': 'Powerplant Induced Shutdown'}, {'label': '70,638', 'value': 70638}, {'label': '-', 'value': None}, {'label': '-', 'value': None}, {'label': '9515 Stop & Shop - IP200 Shutdown (Int Earth Fault)', 'value': '5001W00001UyiTBQAZ'}, {'label': 'true', 'value': True}, {'label': 'false', 'value': False}, {'label': '-', 'value': None}, {'label': '9515 Stop & Shop - IP200 Shutdown (Int Earth Fault)', 'value': '9515 Stop & Shop - IP200 Shutdown (Int Earth Fault)'}]}, {'dataCells': [{'label': '5/8/2019 4:28 AM', 'value': '2019-05-08T08:28:00Z'}, {'label': 'Andrew DeMartini', 'value': '0054000000275kqAAA'}, {'label': 'PureCell 400 - 9601', 'value': 'a0T40000001ltFOEAY'}, {'label': '00068558', 'value': '5001W00001UyiQlQAJ'}, {'label': 'IP200 - Any PCS (Inverter) Shutdown', 'value': 'IP200 - Any PCS (Inverter) Shutdown'}, {'label': 'Failed Start', 'value': 'Failed Start'}, {'label': 'Powerplant Induced Shutdown', 'value': 'Powerplant Induced Shutdown'}, {'label': '21,701', 'value': 21701}, {'label': '5/9/2019 4:45 AM', 'value': '2019-05-09T08:45:00Z'}, {'label': '-', 'value': None}, {'label': '9601 Verizon - IP200 Shutdown (DC Overvoltage)', 'value': '5001W00001UyiQlQAJ'}, {'label': 'true', 'value': True}, {'label': 'false', 'value': False}, {'label': '-', 'value': None}, {'label': '9601 Verizon - IP200 Shutdown (DC Overvoltage)', 'value': '9601 Verizon - IP200 Shutdown (DC Overvoltage)'}]}, {'dataCells': [{'label': '5/8/2019 4:19 AM', 'value': '2019-05-08T08:19:00Z'}, {'label': 'Boram Kim', 'value': '0051W000004MOkdQAG'}, {'label': 'PureCell 400 - 10176', 'value': 'a0T1W000005tN1YUAU'}, {'label': '00068556', 'value': '5001W00001UyiMZQAZ'}, {'label': 'CT430_CALC - TMS conductivity', 'value': 'CT430_CALC - TMS conductivity'}, {'label': 'Outage', 'value': 'Outage'}, {'label': 'Powerplant Induced Shutdown', 'value': 'Powerplant Induced Shutdown'}, {'label': '3,649', 'value': 3649}, {'label': '5/8/2019 6:30 AM', 'value': '2019-05-08T10:30:00Z'}, {'label': '-', 'value': None}, {'label': '10176 West Power 3 - CT430 SD', 'value': '5001W00001UyiMZQAZ'}, {'label': 'true', 'value': True}, {'label': 'false', 'value': False}, {'label': '-', 'value': None}, {'label': '10176 West Power 3 - CT430 SD', 'value': '10176 West Power 3 - CT430 SD'}]}, {'dataCells': [{'label': '5/8/2019 3:16 AM', 'value': '2019-05-08T07:16:00Z'}, {'label': 'Jaejoo Lim', 'value': '005400000033InGAAU'}, {'label': 'PureCell 400 - 9794', 'value': 'a0T40000004TyYSEA0'}, {'label': '00068552', 'value': '5001W00001Uyi5TQAR'}, {'label': 'BC_SD - Burner Controller Shutdown', 'value': 'BC_SD - Burner Controller Shutdown'}, {'label': 'Failed Start', 'value': 'Failed Start'}, {'label': 'Powerplant Induced Shutdown', 'value': 'Powerplant Induced Shutdown'}, {'label': '15,891', 'value': 15891}, {'label': '5/9/2019 1:31 AM', 'value': '2019-05-09T05:31:00Z'}, {'label': '-', 'value': None}, {'label': '9794 Baegot - BC SD', 'value': '5001W00001Uyi5TQAR'}, {'label': 'true', 'value': True}, {'label': 'false', 'value': False}, {'label': '-', 'value': None}, {'label': '9794 Baegot - BC SD', 'value': '9794 Baegot - BC SD'}]}, {'dataCells': [{'label': '5/8/2019 3:13 AM', 'value': '2019-05-08T07:13:00Z'}, {'label': 'Yuhan Ko', 'value': '0051W000004MOkeQAG'}, {'label': 'PureCell 400 - 10143', 'value': 'a0T1W000005PfkmUAC'}, {'label': '00068551', 'value': '5001W00001Uyi3NQAR'}, {'label': 'VDCTotal - Combined Stack Voltage < 690VDC', 'value': 'VDCTotal - Combined Stack Voltage < 690VDC'}, {'label': 'Outage', 'value': 'Outage'}, {'label': 'Powerplant Induced Shutdown', 'value': 'Powerplant Induced Shutdown'}, {'label': '2,539', 'value': 2539}, {'label': '5/8/2019 6:05 AM', 'value': '2019-05-08T10:05:00Z'}, {'label': '-', 'value': None}, {'label': '10143 KOSPO - VDCTOT SD', 'value': '5001W00001Uyi3NQAR'}, {'label': 'true', 'value': True}, {'label': 'false', 'value': False}, {'label': '-', 'value': None}, {'label': '10143 KOSPO - VDCTOT SD', 'value': '10143 KOSPO - VDCTOT SD'}]}, {'dataCells': [{'label': '5/8/2019 3:04 AM', 'value': '2019-05-08T07:04:00Z'}, {'label': 'Boram Kim', 'value': '0051W000004MOkdQAG'}, {'label': 'PureCell 400 - 10186', 'value': 'a0T1W000005tN1iUAE'}, {'label': '00068549', 'value': '5001W00001Uyi1bQAB'}, {'label': 'IP200 - Any PCS (Inverter) Shutdown', 'value': 'IP200 - Any PCS (Inverter) Shutdown'}, {'label': 'Outage', 'value': 'Outage'}, {'label': 'Powerplant Induced Shutdown', 'value': 'Powerplant Induced Shutdown'}, {'label': '3,745', 'value': 3745}, {'label': '5/9/2019 5:49 AM', 'value': '2019-05-09T09:49:00Z'}, {'label': '-', 'value': None}, {'label': '10186 West Power 3 - IP200 SD (PCS100 Fault)', 'value': '5001W00001Uyi1bQAB'}, {'label': 'true', 'value': True}, {'label': 'false', 'value': False}, {'label': '-', 'value': None}, {'label': '10186 West Power 3 - IP200 SD (PCS100 Fault)', 'value': '10186 West Power 3 - IP200 SD (PCS100 Fault)'}]}, {'dataCells': [{'label': '5/8/2019 2:13 AM', 'value': '2019-05-08T06:13:00Z'}, {'label': 'Jaejoo Lim', 'value': '005400000033InGAAU'}, {'label': 'PureCell 400 - 9510', 'value': 'a0T40000001cWPpEAM'}, {'label': '00068547', 'value': '5001W00001UyhuuQAB'}, {'label': 'IP200 - Any PCS (Inverter) Shutdown', 'value': 'IP200 - Any PCS (Inverter) Shutdown'}, {'label': 'Failed Start', 'value': 'Failed Start'}, {'label': 'Powerplant Induced Shutdown', 'value': 'Powerplant Induced Shutdown'}, {'label': '1,105', 'value': 1105}, {'label': '5/8/2019 5:41 AM', 'value': '2019-05-08T09:41:00Z'}, {'label': '-', 'value': None}, {'label': '9510 GS Power - IP200 SD (DC Under Voltage Fault)', 'value': '5001W00001UyhuuQAB'}, {'label': 'true', 'value': True}, {'label': 'false', 'value': False}, {'label': '-', 'value': None}, {'label': '9510 GS Power - IP200 SD (DC Under Voltage Fault)', 'value': '9510 GS Power - IP200 SD (DC Under Voltage Fault)'}]}, {'dataCells': [{'label': '5/7/2019 10:35 PM', 'value': '2019-05-08T02:35:00Z'}, {'label': 'Kyounghoon Cho', 'value': '0054000000476RSAAY'}, {'label': 'PureCell 400 - 9593', 'value': 'a0T40000001ltFGEAY'}, {'label': '00068530', 'value': '5001W00001UyhgxQAB'}, {'label': 'TE012FT - Reformer Tube Temperature  Fault Tolerant Output', 'value': 'TE012FT - Reformer Tube Temperature  Fault Tolerant Output'}, {'label': 'Outage', 'value': 'Outage'}, {'label': 'Powerplant Induced Shutdown', 'value': 'Powerplant Induced Shutdown'}, {'label': '1', 'value': 1}, {'label': '5/8/2019 4:39 AM', 'value': '2019-05-08T08:39:00Z'}, {'label': '-', 'value': None}, {'label': '9593 Lotte - TE012 FT SD', 'value': '5001W00001UyhgxQAB'}, {'label': 'true', 'value': True}, {'label': 'false', 'value': False}, {'label': '-', 'value': None}, {'label': '9593 Lotte - TE012 FT SD', 'value': '9593 Lotte - TE012 FT SD'}]}, {'dataCells': [{'label': '5/7/2019 7:22 PM', 'value': '2019-05-07T23:22:00Z'}, {'label': 'Justin Reynolds', 'value': '00540000001d3HZAAY'}, {'label': 'PureCell 400 - 9692', 'value': 'a0T40000002PjYZEA0'}, {'label': '00068508', 'value': '5001W00001UygyMQAR'}, {'label': 'AT160 - Combustibility Sensor', 'value': 'AT160 - Combustibility Sensor'}, {'label': 'Failed Start', 'value': 'Failed Start'}, {'label': 'Powerplant Induced Shutdown', 'value': 'Powerplant Induced Shutdown'}, {'label': '2,513', 'value': 2513}, {'label': '5/10/2019 9:14 PM', 'value': '2019-05-11T01:14:00Z'}, {'label': '-', 'value': None}, {'label': '9692 West Haven - AT160 + LOR SD', 'value': '5001W00001UygyMQAR'}, {'label': 'true', 'value': True}, {'label': 'false', 'value': False}, {'label': '-', 'value': None}, {'label': 'Unit was put into start and shutdown almost immediately due to AT160 + LOR\r\n\r\nThis PPLT experienced the same issue in April.  WO from that case states the following:\r\nreset LOR. \r\nchecked for leaks. none found. \r\nreplaced AT160 sensor and transmitter. \r\nsensor was near replacement date. \r\ntransmitter showed signs of damage. \r\ncompleted prestart checks.\r\n\r\n1. Use FCM79102 as needed to tshoot AT160 and LOR Shutdowns\r\n\r\nJR: when tech was on site yesterday, AT160 read ~1.6%. Technically pre start checks would have NOT said there was a problem.\r\nIf you look at the data AT160 goes to -12% real quick yesterday too.\r\n\r\nboth this SD and one from April happen the same way. When CV720 opens to purge, AT160 goes up. I suspect a leak in the newly installed CSA D.', 'value': 'Unit was put into start and shutdown almost immediately due to AT160 + LOR\r\n\r\nThis PPLT experienced the same issue in April.  WO from that case states the following:\r\nreset LOR. \r\nchecked for leaks. none found. \r\nreplaced AT160 sensor and transmitter. \r\nsensor was near replacement date. \r\ntransmitter showed signs of damage. \r\ncompleted prestart checks.\r\n\r\n1. Use FCM79102 as needed to tshoot AT160 and LOR Shutdowns\r\n\r\nJR: when tech was on site yesterday, AT160 read ~1.6%. Technically pre start checks would have NOT said there was a problem.\r\nIf you look at the data AT160 goes to -12% real quick yesterday too.\r\n\r\nboth this SD and one from April happen the same way. When CV720 opens to purge, AT160 goes up. I suspect a leak in the newly installed CSA D.'}]}, {'dataCells': [{'label': '5/7/2019 7:02 PM', 'value': '2019-05-07T23:02:00Z'}, {'label': 'Sinho Song', 'value': '00540000003dfQoAAI'}, {'label': 'PureCell 400 - 9643', 'value': 'a0T40000002PjXmEAK'}, {'label': '00068505', 'value': '5001W00001Uyg9iQAB'}, {'label': '<NORMAL_SHUTDOWN> - Normal Shutdown Signal from LOI', 'value': '<NORMAL_SHUTDOWN> - Normal Shutdown Signal from LOI'}, {'label': 'Outage', 'value': 'Outage'}, {'label': 'Powerplant Induced Shutdown', 'value': 'Powerplant Induced Shutdown'}, {'label': '20,216', 'value': 20216}, {'label': '5/8/2019 11:57 AM', 'value': '2019-05-08T15:57:00Z'}, {'label': '-', 'value': None}, {'label': '9643 BGE  Manual SD to replace CSA D', 'value': '5001W00001Uyg9iQAB'}, {'label': 'true', 'value': True}, {'label': 'false', 'value': False}, {'label': '-', 'value': None}, {'label': '9643 BGE  Manual SD to replace CSA D', 'value': '9643 BGE  Manual SD to replace CSA D'}]}, {'dataCells': [{'label': '5/7/2019 6:45 PM', 'value': '2019-05-07T22:45:00Z'}, {'label': 'Sinho Song', 'value': '00540000003dfQoAAI'}, {'label': 'PureCell 400 - 9744', 'value': 'a0T40000004TyXeEAK'}, {'label': '00068507', 'value': '5001W00001UygoRQAR'}, {'label': 'IP200 - Any PCS (Inverter) Shutdown', 'value': 'IP200 - Any PCS (Inverter) Shutdown'}, {'label': 'Outage', 'value': 'Outage'}, {'label': 'Powerplant Induced Shutdown', 'value': 'Powerplant Induced Shutdown'}, {'label': '16,730', 'value': 16730}, {'label': '5/8/2019 12:08 AM', 'value': '2019-05-08T04:08:00Z'}, {'label': '-', 'value': None}, {'label': '9744 BGE - IP200 SD (LOR)', 'value': '5001W00001UygoRQAR'}, {'label': 'true', 'value': True}, {'label': 'false', 'value': False}, {'label': '-', 'value': None}, {'label': '9744 BGE - IP200 SD (LOR)', 'value': '9744 BGE - IP200 SD (LOR)'}]}, {'dataCells': [{'label': '5/7/2019 6:38 PM', 'value': '2019-05-07T22:38:00Z'}, {'label': 'Boram Kim', 'value': '0051W000004MOkdQAG'}, {'label': 'PureCell 400 - 10188', 'value': 'a0T1W000005tN1kUAE'}, {'label': '00068506', 'value': '5001W00001UygmkQAB'}, {'label': 'CT430_CALC - TMS conductivity', 'value': 'CT430_CALC - TMS conductivity'}, {'label': 'Outage', 'value': 'Outage'}, {'label': 'Powerplant Induced Shutdown', 'value': 'Powerplant Induced Shutdown'}, {'label': '1,869', 'value': 1869}, {'label': '5/8/2019 3:30 AM', 'value': '2019-05-08T07:30:00Z'}, {'label': '-', 'value': None}, {'label': '10188 West Power 3 - CT430 SD', 'value': '5001W00001UygmkQAB'}, {'label': 'true', 'value': True}, {'label': 'false', 'value': False}, {'label': '-', 'value': None}, {'label': '10188 West Power 3 - CT430 SD', 'value': '10188 West Power 3 - CT430 SD'}]}, {'dataCells': [{'label': '5/7/2019 11:22 AM', 'value': '2019-05-07T15:22:00Z'}, {'label': 'Sinho Song', 'value': '00540000003dfQoAAI'}, {'label': 'PureCell 400 - 9702', 'value': 'a0T40000004TyWyEAK'}, {'label': '00068499', 'value': '5001W00001Uyc37QAB'}, {'label': '<NORMAL_SHUTDOWN> - Normal Shutdown Signal from LOI', 'value': '<NORMAL_SHUTDOWN> - Normal Shutdown Signal from LOI'}, {'label': 'Outage', 'value': 'Outage'}, {'label': 'Powerplant Induced Shutdown', 'value': 'Powerplant Induced Shutdown'}, {'label': '17,739', 'value': 17739}, {'label': '5/11/2019 9:45 AM', 'value': '2019-05-11T13:45:00Z'}, {'label': '-', 'value': None}, {'label': '9702 BGE - Manual SD to replace REF/ILS', 'value': '5001W00001Uyc37QAB'}, {'label': 'true', 'value': True}, {'label': 'false', 'value': False}, {'label': '-', 'value': None}, {'label': '9702 BGE - Manual SD to replace REF/ILS', 'value': '9702 BGE - Manual SD to replace REF/ILS'}]}, {'dataCells': [{'label': '5/7/2019 11:12 AM', 'value': '2019-05-07T15:12:00Z'}, {'label': 'Jaejoo Lim', 'value': '005400000033InGAAU'}, {'label': 'PureCell 400 - 9791', 'value': 'a0T40000004TyYPEA0'}, {'label': '00068500', 'value': '5001W00001Uyc5hQAB'}, {'label': 'LT400 - Separator Level Transmitter', 'value': 'LT400 - Separator Level Transmitter'}, {'label': 'Outage', 'value': 'Outage'}, {'label': 'Powerplant Induced Shutdown', 'value': 'Powerplant Induced Shutdown'}, {'label': '15,654', 'value': 15654}, {'label': '5/8/2019 1:09 AM', 'value': '2019-05-08T05:09:00Z'}, {'label': '-', 'value': None}, {'label': '9791 Baegot - LT400 SD', 'value': '5001W00001Uyc5hQAB'}, {'label': 'true', 'value': True}, {'label': 'false', 'value': False}, {'label': '-', 'value': None}, {'label': '9791 Baegot - LT400 SD', 'value': '9791 Baegot - LT400 SD'}]}, {'dataCells': [{'label': '5/7/2019 9:17 AM', 'value': '2019-05-07T13:17:00Z'}, {'label': 'Boram Kim', 'value': '0051W000004MOkdQAG'}, {'label': 'PureCell 400 - 10170', 'value': 'a0T1W000005tN1SUAU'}, {'label': '00068497', 'value': '5001W00001UyaniQAB'}, {'label': 'CV000_STATUS - Fuel Valve Feedback', 'value': 'CV000_STATUS - Fuel Valve Feedback'}, {'label': 'Failed Start', 'value': 'Failed Start'}, {'label': 'Powerplant Induced Shutdown', 'value': 'Powerplant Induced Shutdown'}, {'label': '1,518', 'value': 1518}, {'label': '5/8/2019 3:10 AM', 'value': '2019-05-08T07:10:00Z'}, {'label': '-', 'value': None}, {'label': '10170 West Power 3 - CV000 SD', 'value': '5001W00001UyaniQAB'}, {'label': 'true', 'value': True}, {'label': 'false', 'value': False}, {'label': '-', 'value': None}, {'label': '10170 West Power 3 - CV000 SD', 'value': '10170 West Power 3 - CV000 SD'}]}, {'dataCells': [{'label': '5/7/2019 8:21 AM', 'value': '2019-05-07T12:21:00Z'}, {'label': 'Kyounghoon Cho', 'value': '0054000000476RSAAY'}, {'label': 'PureCell 400 - 9592', 'value': 'a0T40000001ltFFEAY'}, {'label': '00068496', 'value': '5001W00001UyaQ5QAJ'}, {'label': 'IP200 - Any PCS (Inverter) Shutdown', 'value': 'IP200 - Any PCS (Inverter) Shutdown'}, {'label': 'Outage', 'value': 'Outage'}, {'label': 'Powerplant Induced Shutdown', 'value': 'Powerplant Induced Shutdown'}, {'label': '17,656', 'value': 17656}, {'label': '5/8/2019 6:29 AM', 'value': '2019-05-08T10:29:00Z'}, {'label': '-', 'value': None}, {'label': '9592 Lotte - IP200 SD(ON Board Temp)', 'value': '5001W00001UyaQ5QAJ'}, {'label': 'true', 'value': True}, {'label': 'false', 'value': False}, {'label': 'It has HMI access issue. So, cannot ramped down.\r\nAlso NETA cannot access. It need to be updated.', 'value': 'It has HMI access issue. So, cannot ramped down.\r\nAlso NETA cannot access. It need to be updated.'}, {'label': '9592 Lotte - IP200 SD(ON Board Temp)', 'value': '9592 Lotte - IP200 SD(ON Board Temp)'}]}, {'dataCells': [{'label': '5/7/2019 7:00 AM', 'value': '2019-05-07T11:00:00Z'}, {'label': 'Youngjun Choi', 'value': '0051W000005Ut1TQAS'}, {'label': 'PureCell 400 - 9843', 'value': 'a0T40000005NktkEAC'}, {'label': '00068493', 'value': '5001W00001Uya6AQAR'}, {'label': 'LOR_STATUS (Note 7) - ECS Lockout Relay Status Signal', 'value': 'LOR_STATUS (Note 7) - ECS Lockout Relay Status Signal'}, {'label': 'Outage', 'value': 'Outage'}, {'label': 'Powerplant Induced Shutdown', 'value': 'Powerplant Induced Shutdown'}, {'label': '3,058', 'value': 3058}, {'label': '5/8/2019 12:26 AM', 'value': '2019-05-08T04:26:00Z'}, {'label': '-', 'value': None}, {'label': '9843 PTES 2 - LOR SD', 'value': '5001W00001Uya6AQAR'}, {'label': 'true', 'value': True}, {'label': 'false', 'value': False}, {'label': '-', 'value': None}, {'label': '9843 PTES 2 - LOR SD', 'value': '9843 PTES 2 - LOR SD'}]}, {'dataCells': [{'label': '5/7/2019 5:58 AM', 'value': '2019-05-07T09:58:00Z'}, {'label': 'Jaejoo Lim', 'value': '005400000033InGAAU'}, {'label': 'PureCell 400 - 9794', 'value': 'a0T40000004TyYSEA0'}, {'label': '00068491', 'value': '5001W00001UyZnNQAV'}, {'label': 'BC_SD - Burner Controller Shutdown', 'value': 'BC_SD - Burner Controller Shutdown'}, {'label': 'Failed Start', 'value': 'Failed Start'}, {'label': 'Powerplant Induced Shutdown', 'value': 'Powerplant Induced Shutdown'}, {'label': '15,891', 'value': 15891}, {'label': '5/8/2019 3:16 AM', 'value': '2019-05-08T07:16:00Z'}, {'label': '-', 'value': None}, {'label': '9794 Baegot - BC SD', 'value': '5001W00001UyZnNQAV'}, {'label': 'true', 'value': True}, {'label': 'false', 'value': False}, {'label': '-', 'value': None}, {'label': '9794 Baegot - BC SD', 'value': '9794 Baegot - BC SD'}]}, {'dataCells': [{'label': '5/7/2019 5:47 AM', 'value': '2019-05-07T09:47:00Z'}, {'label': 'Hyemi Ahn', 'value': '0051W0000056xYiQAI'}, {'label': 'PureCell 400 - 10050', 'value': 'a0T40000005NkujEAC'}, {'label': '00068490', 'value': '5001W00001UyZllQAF'}, {'label': 'VDCTotal - Combined Stack Voltage < 690VDC', 'value': 'VDCTotal - Combined Stack Voltage < 690VDC'}, {'label': 'Outage', 'value': 'Outage'}, {'label': 'Powerplant Induced Shutdown', 'value': 'Powerplant Induced Shutdown'}, {'label': '5,519', 'value': 5519}, {'label': '5/8/2019 3:01 AM', 'value': '2019-05-08T07:01:00Z'}, {'label': '-', 'value': None}, {'label': '10050 KOEN 4 - VDCTOT SD', 'value': '5001W00001UyZllQAF'}, {'label': 'true', 'value': True}, {'label': 'false', 'value': False}, {'label': '-', 'value': None}, {'label': '10050 KOEN 4 - VDCTOT SD', 'value': '10050 KOEN 4 - VDCTOT SD'}]}, {'dataCells': [{'label': '5/7/2019 5:29 AM', 'value': '2019-05-07T09:29:00Z'}, {'label': 'Mooseung Choi', 'value': '0051W0000056xYsQAI'}, {'label': 'PureCell 400 - 9613', 'value': 'a0T40000003nbeYEAQ'}, {'label': '00068489', 'value': '5001W00001UyZhjQAF'}, {'label': 'VT310DELB - Half Stack Voltage Delta, Stack B', 'value': 'VT310DELB - Half Stack Voltage Delta, Stack B'}, {'label': 'Outage', 'value': 'Outage'}, {'label': 'Powerplant Induced Shutdown', 'value': 'Powerplant Induced Shutdown'}, {'label': '6,644', 'value': 6644}, {'label': '5/8/2019 5:19 AM', 'value': '2019-05-08T09:19:00Z'}, {'label': '-', 'value': None}, {'label': '9613 KOEN Ansan - VT310DelB SD', 'value': '5001W00001UyZhjQAF'}, {'label': 'true', 'value': True}, {'label': 'false', 'value': False}, {'label': '-', 'value': None}, {'label': '9613 KOEN Ansan - VT310DelB SD', 'value': '9613 KOEN Ansan - VT310DelB SD'}]}, {'dataCells': [{'label': '5/7/2019 5:02 AM', 'value': '2019-05-07T09:02:00Z'}, {'label': 'Jinhee Na', 'value': '0051W000003rZIsQAM'}, {'label': 'PureCell 400 - 10029', 'value': 'a0T40000005NkuOEAS'}, {'label': '00068484', 'value': '5001W00001UyZVEQA3'}, {'label': '<NORMAL_SHUTDOWN> - Normal Shutdown Signal from LOI', 'value': '<NORMAL_SHUTDOWN> - Normal Shutdown Signal from LOI'}, {'label': 'Outage', 'value': 'Outage'}, {'label': 'Powerplant Induced Shutdown', 'value': 'Powerplant Induced Shutdown'}, {'label': '9,649', 'value': 9649}, {'label': '-', 'value': None}, {'label': '-', 'value': None}, {'label': '10029 EWP - Manual SD to replace REF/ILS', 'value': '5001W00001UyZVEQA3'}, {'label': 'true', 'value': True}, {'label': 'false', 'value': False}, {'label': '-', 'value': None}, {'label': '10029 EWP - Manual SD to replace REF/ILS\r\n\r\n* REF/ILS will replace on 14.May because of low REF conversion.', 'value': '10029 EWP - Manual SD to replace REF/ILS\r\n\r\n* REF/ILS will replace on 14.May because of low REF conversion.'}]}, {'dataCells': [{'label': '5/7/2019 4:41 AM', 'value': '2019-05-07T08:41:00Z'}, {'label': 'Hyemi Ahn', 'value': '0051W0000056xYiQAI'}, {'label': 'PureCell 400 - 9782', 'value': 'a0T40000004TyYGEA0'}, {'label': '00068486', 'value': '5001W00001UyZXjQAN'}, {'label': 'IP200 - Any PCS (Inverter) Shutdown', 'value': 'IP200 - Any PCS (Inverter) Shutdown'}, {'label': 'Failed Start', 'value': 'Failed Start'}, {'label': 'Powerplant Induced Shutdown', 'value': 'Powerplant Induced Shutdown'}, {'label': '6,348', 'value': 6348}, {'label': '5/10/2019 2:49 AM', 'value': '2019-05-10T06:49:00Z'}, {'label': '-', 'value': None}, {'label': '9782 KOEN 4 - IP200 SD (PCS100 PCS GENERAL FAULT)', 'value': '5001W00001UyZXjQAN'}, {'label': 'true', 'value': True}, {'label': 'false', 'value': False}, {'label': '-', 'value': None}, {'label': '9782 KOEN 4 - IP200 SD (PCS100 PCS GENERAL FAULT)', 'value': '9782 KOEN 4 - IP200 SD (PCS100 PCS GENERAL FAULT)'}]}, {'dataCells': [{'label': '5/7/2019 4:11 AM', 'value': '2019-05-07T08:11:00Z'}, {'label': 'Hyemi Ahn', 'value': '0051W0000056xYiQAI'}, {'label': 'PureCell 400 - 9779', 'value': 'a0T40000004TyYDEA0'}, {'label': '00068478', 'value': '5001W00001UyZ8oQAF'}, {'label': '<NORMAL_SHUTDOWN> - Normal Shutdown Signal from LOI', 'value': '<NORMAL_SHUTDOWN> - Normal Shutdown Signal from LOI'}, {'label': 'Outage', 'value': 'Outage'}, {'label': 'Powerplant Induced Shutdown', 'value': 'Powerplant Induced Shutdown'}, {'label': '7,881', 'value': 7881}, {'label': '-', 'value': None}, {'label': '-', 'value': None}, {'label': '9779 KOEN 4 - Manual SD to replace REF/ILS', 'value': '5001W00001UyZ8oQAF'}, {'label': 'true', 'value': True}, {'label': 'false', 'value': False}, {'label': '-', 'value': None}, {'label': '9779 KOEN 4 - Manual SD to replace REF/ILS', 'value': '9779 KOEN 4 - Manual SD to replace REF/ILS'}]}, {'dataCells': [{'label': '5/7/2019 3:21 AM', 'value': '2019-05-07T07:21:00Z'}, {'label': 'Boram Kim', 'value': '0051W000004MOkdQAG'}, {'label': 'PureCell 400 - 10150', 'value': 'a0T1W000005PfktUAC'}, {'label': '00068482', 'value': '5001W00001UyZRCQA3'}, {'label': 'BC_SD - Burner Controller Shutdown', 'value': 'BC_SD - Burner Controller Shutdown'}, {'label': 'Failed Start', 'value': 'Failed Start'}, {'label': 'Powerplant Induced Shutdown', 'value': 'Powerplant Induced Shutdown'}, {'label': '1,099', 'value': 1099}, {'label': '5/7/2019 10:02 AM', 'value': '2019-05-07T14:02:00Z'}, {'label': '-', 'value': None}, {'label': '10150 West Power 3 - BC SD', 'value': '5001W00001UyZRCQA3'}, {'label': 'true', 'value': True}, {'label': 'false', 'value': False}, {'label': '-', 'value': None}, {'label': '10150 West Power 3 - BC SD', 'value': '10150 West Power 3 - BC SD'}]}, {'dataCells': [{'label': '5/7/2019 2:15 AM', 'value': '2019-05-07T06:15:00Z'}, {'label': 'Hyemi Ahn', 'value': '0051W0000056xYiQAI'}, {'label': 'PureCell 400 - 10002', 'value': 'a0T40000005NktxEAC'}, {'label': '00068476', 'value': '5001W00001UyYwTQAV'}, {'label': 'CV000_STATUS - Fuel Valve Feedback', 'value': 'CV000_STATUS - Fuel Valve Feedback'}, {'label': 'Failed Start', 'value': 'Failed Start'}, {'label': 'Powerplant Induced Shutdown', 'value': 'Powerplant Induced Shutdown'}, {'label': '6,829', 'value': 6829}, {'label': '5/8/2019 7:12 AM', 'value': '2019-05-08T11:12:00Z'}, {'label': 'New (please add description in comments)', 'value': 'New (please add description in comments)'}, {'label': '10002 KOEN 4 - CV000 SD', 'value': '5001W00001UyYwTQAV'}, {'label': 'false', 'value': False}, {'label': 'true', 'value': True}, {'label': "INVVAC_AB,BC,CA=0, GridVAC_AB,BC,CA=0. VSD140 curr was low so CV000(BC code 'A') occurred. Replaced GDM.", 'value': "INVVAC_AB,BC,CA=0, GridVAC_AB,BC,CA=0. VSD140 curr was low so CV000(BC code 'A') occurred. Replaced GDM."}, {'label': '10002 KOEN 4 - CV000 SD', 'value': '10002 KOEN 4 - CV000 SD'}]}, {'dataCells': [{'label': '5/7/2019 1:26 AM', 'value': '2019-05-07T05:26:00Z'}, {'label': 'Jaejoo Lim', 'value': '005400000033InGAAU'}, {'label': 'PureCell 400 - 9791', 'value': 'a0T40000004TyYPEA0'}, {'label': '00068472', 'value': '5001W00001UyYqaQAF'}, {'label': 'IP200 - Any PCS (Inverter) Shutdown', 'value': 'IP200 - Any PCS (Inverter) Shutdown'}, {'label': 'Failed Start', 'value': 'Failed Start'}, {'label': 'Powerplant Induced Shutdown', 'value': 'Powerplant Induced Shutdown'}, {'label': '15,650', 'value': 15650}, {'label': '5/7/2019 8:27 AM', 'value': '2019-05-07T12:27:00Z'}, {'label': '-', 'value': None}, {'label': '9791 Baegot - IP200 SD (PCS 100 SWITCHING TIMEOUT)', 'value': '5001W00001UyYqaQAF'}, {'label': 'true', 'value': True}, {'label': 'false', 'value': False}, {'label': '-', 'value': None}, {'label': '9791 Baegot - IP200 SD (PCS 100 SWITCHING TIMEOUT)', 'value': '9791 Baegot - IP200 SD (PCS 100 SWITCHING TIMEOUT)'}]}, {'dataCells': [{'label': '5/7/2019 12:39 AM', 'value': '2019-05-07T04:39:00Z'}, {'label': 'Sinho Song', 'value': '00540000003dfQoAAI'}, {'label': 'PureCell 400 - 9648', 'value': 'a0T40000002PjXrEAK'}, {'label': '00068468', 'value': '5001W00001UyYjAQAV'}, {'label': 'IP200 - Any PCS (Inverter) Shutdown', 'value': 'IP200 - Any PCS (Inverter) Shutdown'}, {'label': 'Outage', 'value': 'Outage'}, {'label': 'Powerplant Induced Shutdown', 'value': 'Powerplant Induced Shutdown'}, {'label': '251', 'value': 251}, {'label': '5/7/2019 5:36 AM', 'value': '2019-05-07T09:36:00Z'}, {'label': '-', 'value': None}, {'label': '9648 BGE - IP200 SD (DC Under Voltage)', 'value': '5001W00001UyYjAQAV'}, {'label': 'true', 'value': True}, {'label': 'false', 'value': False}, {'label': '-', 'value': None}, {'label': '9648 BGE - IP200 SD (DC Under Voltage)', 'value': '9648 BGE - IP200 SD (DC Under Voltage)'}]}, {'dataCells': [{'label': '5/6/2019 8:54 PM', 'value': '2019-05-07T00:54:00Z'}, {'label': 'Youngjun Choi', 'value': '0051W000005Ut1TQAS'}, {'label': 'PureCell 400 - 9828', 'value': 'a0T40000005MyvxEAC'}, {'label': '00068458', 'value': '5001W00001UyYF0QAN'}, {'label': 'FT012ERR - Fuel Flow Error', 'value': 'FT012ERR - Fuel Flow Error'}, {'label': 'Outage', 'value': 'Outage'}, {'label': 'Powerplant Induced Shutdown', 'value': 'Powerplant Induced Shutdown'}, {'label': '11,236', 'value': 11236}, {'label': '5/7/2019 6:43 AM', 'value': '2019-05-07T10:43:00Z'}, {'label': 'No Fault Found', 'value': 'No Fault Found'}, {'label': '9828 Samchully - FT012ERR SD', 'value': '5001W00001UyYF0QAN'}, {'label': 'false', 'value': False}, {'label': 'true', 'value': True}, {'label': 'no fault found', 'value': 'no fault found'}, {'label': '9828 Samchully - FT012ERR SD', 'value': '9828 Samchully - FT012ERR SD'}]}, {'dataCells': [{'label': '5/6/2019 4:32 PM', 'value': '2019-05-06T20:32:00Z'}, {'label': 'Frank Fragola', 'value': '00540000001d3HKAAY'}, {'label': 'PureCell 400 - 9692', 'value': 'a0T40000002PjYZEA0'}, {'label': '00068449', 'value': '5001W00001UyWv5QAF'}, {'label': 'CV000_STATUS - Fuel Valve Feedback', 'value': 'CV000_STATUS - Fuel Valve Feedback'}, {'label': 'Outage', 'value': 'Outage'}, {'label': 'Powerplant Induced Shutdown', 'value': 'Powerplant Induced Shutdown'}, {'label': '2,513', 'value': 2513}, {'label': '5/7/2019 7:22 PM', 'value': '2019-05-07T23:22:00Z'}, {'label': '-', 'value': None}, {'label': '9692 West Haven - CV000 Shutdown', 'value': '5001W00001UyWv5QAF'}, {'label': 'true', 'value': True}, {'label': 'false', 'value': False}, {'label': '-', 'value': None}, {'label': 'PPLT had a CV000 s/d on 4/16/19\r\n9692 tripped to Idle 6 seconds prior to s/d \r\n\r\n1. Record Burner Controller Code in the drop down menu in the Site Check Information section of the WO. \r\n2. Attach a photo of the burner controller to the WO. If damage (electrical/thermal) is also noticed on the burner controller include a photo of that as well. \r\n3. Use BC Troubleshooting Guide FCM79157_Rev J PDF available in ServiceMax to troubleshoot the shutdown: \r\nFlashing A: Page 3 \r\nFlashing U: Page 4 \r\nFlashing F: Pages 5-7 \r\nFlashing d: Page 8 \r\nBlank Screen/No Power: Page 9 \r\nFlashing L: Page 10 \r\nFlashing E: Page 11 \r\nSolid t: Page 12 \r\n4. Include detailed record of troubleshooting steps taken in the WO closure.', 'value': 'PPLT had a CV000 s/d on 4/16/19\r\n9692 tripped to Idle 6 seconds prior to s/d \r\n\r\n1. Record Burner Controller Code in the drop down menu in the Site Check Information section of the WO. \r\n2. Attach a photo of the burner controller to the WO. If damage (electrical/thermal) is also noticed on the burner controller include a photo of that as well. \r\n3. Use BC Troubleshooting Guide FCM79157_Rev J PDF available in ServiceMax to troubleshoot the shutdown: \r\nFlashing A: Page 3 \r\nFlashing U: Page 4 \r\nFlashing F: Pages 5-7 \r\nFlashing d: Page 8 \r\nBlank Screen/No Power: Page 9 \r\nFlashing L: Page 10 \r\nFlashing E: Page 11 \r\nSolid t: Page 12 \r\n4. Include detailed record of troubleshooting steps taken in the WO closure.'}]}, {'dataCells': [{'label': '5/6/2019 12:16 PM', 'value': '2019-05-06T16:16:00Z'}, {'label': 'Justin Reynolds', 'value': '00540000001d3HZAAY'}, {'label': 'PureCell 400 - 9506', 'value': 'a0T40000001cWNtEAM'}, {'label': '00068447', 'value': '5001W00001UyURwQAN'}, {'label': '<NORMAL_SHUTDOWN> - Normal Shutdown Signal from LOI', 'value': '<NORMAL_SHUTDOWN> - Normal Shutdown Signal from LOI'}, {'label': 'Outage', 'value': 'Outage'}, {'label': 'Powerplant Induced Shutdown', 'value': 'Powerplant Induced Shutdown'}, {'label': '38,780', 'value': 38780}, {'label': '-', 'value': None}, {'label': '-', 'value': None}, {'label': '9506 P&W -- Manual SD', 'value': '5001W00001UyURwQAN'}, {'label': 'true', 'value': True}, {'label': 'false', 'value': False}, {'label': '-', 'value': None}, {'label': '9506 P&W -- Manual SD\nUnit was manually shutdown due to a failed stack', 'value': '9506 P&W -- Manual SD\nUnit was manually shutdown due to a failed stack'}]}, {'dataCells': [{'label': '5/6/2019 11:07 AM', 'value': '2019-05-06T15:07:00Z'}, {'label': 'Youngjun Choi', 'value': '0051W000005Ut1TQAS'}, {'label': 'PureCell 400 - 9821', 'value': 'a0T40000003DsGnEAK'}, {'label': '00068443', 'value': '5001W00001UyTJxQAN'}, {'label': '<NORMAL_SHUTDOWN> - Normal Shutdown Signal from LOI', 'value': '<NORMAL_SHUTDOWN> - Normal Shutdown Signal from LOI'}, {'label': 'Outage', 'value': 'Outage'}, {'label': 'Powerplant Induced Shutdown', 'value': 'Powerplant Induced Shutdown'}, {'label': '12,613', 'value': 12613}, {'label': '5/11/2019 9:25 AM', 'value': '2019-05-11T13:25:00Z'}, {'label': '-', 'value': None}, {'label': '9821 Midland - Manual SD to replace REF/ILS', 'value': '5001W00001UyTJxQAN'}, {'label': 'true', 'value': True}, {'label': 'false', 'value': False}, {'label': '-', 'value': None}, {'label': '9821 Midland - Manual SD to replace REF/ILS', 'value': '9821 Midland - Manual SD to replace REF/ILS'}]}, {'dataCells': [{'label': '5/6/2019 10:05 AM', 'value': '2019-05-06T14:05:00Z'}, {'label': 'Hyemi Ahn', 'value': '0051W0000056xYiQAI'}, {'label': 'PureCell 400 - 9782', 'value': 'a0T40000004TyYGEA0'}, {'label': '00068441', 'value': '5001W00001UySmoQAF'}, {'label': 'IP200 - Any PCS (Inverter) Shutdown', 'value': 'IP200 - Any PCS (Inverter) Shutdown'}, {'label': 'Outage', 'value': 'Outage'}, {'label': 'Powerplant Induced Shutdown', 'value': 'Powerplant Induced Shutdown'}, {'label': '6,348', 'value': 6348}, {'label': '5/7/2019 4:41 AM', 'value': '2019-05-07T08:41:00Z'}, {'label': '-', 'value': None}, {'label': '9782 KOEN 4 - IP200 SD(PCS100 Stop Switching timeout)', 'value': '5001W00001UySmoQAF'}, {'label': 'true', 'value': True}, {'label': 'false', 'value': False}, {'label': '-', 'value': None}, {'label': '9782 KOEN 4 - IP200 SD(PCS100 Stop Switching timeout)', 'value': '9782 KOEN 4 - IP200 SD(PCS100 Stop Switching timeout)'}]}, {'dataCells': [{'label': '5/5/2019 5:32 PM', 'value': '2019-05-05T21:32:00Z'}, {'label': 'Yuhan Ko', 'value': '0051W000004MOkeQAG'}, {'label': 'PureCell 400 - 10159', 'value': 'a0T1W000005tN1HUAU'}, {'label': '00068422', 'value': '5001W00001UyQ7AQAV'}, {'label': 'CT430_CALC - TMS conductivity', 'value': 'CT430_CALC - TMS conductivity'}, {'label': 'Outage', 'value': 'Outage'}, {'label': 'Powerplant Induced Shutdown', 'value': 'Powerplant Induced Shutdown'}, {'label': '2,614', 'value': 2614}, {'label': '5/7/2019 2:57 AM', 'value': '2019-05-07T06:57:00Z'}, {'label': 'CT430', 'value': 'CT430'}, {'label': '10159 KOSPO - CT430 SD', 'value': '5001W00001UyQ7AQAV'}, {'label': 'true', 'value': True}, {'label': 'false', 'value': False}, {'label': 'Replaced Resin bottle.', 'value': 'Replaced Resin bottle.'}, {'label': '10159 KOSPO - CT430 SD', 'value': '10159 KOSPO - CT430 SD'}]}, {'dataCells': [{'label': '5/5/2019 2:15 AM', 'value': '2019-05-05T06:15:00Z'}, {'label': 'Minhee Kim', 'value': '0051W0000056xYnQAI'}, {'label': 'PureCell 400 - 9588', 'value': 'a0T40000001ltFBEAY'}, {'label': '00068418', 'value': '5001W00001UyP5wQAF'}, {'label': 'IP200 - Any PCS (Inverter) Shutdown', 'value': 'IP200 - Any PCS (Inverter) Shutdown'}, {'label': 'Outage', 'value': 'Outage'}, {'label': 'Powerplant Induced Shutdown', 'value': 'Powerplant Induced Shutdown'}, {'label': '31,097', 'value': 31097}, {'label': '5/7/2019 5:07 AM', 'value': '2019-05-07T09:07:00Z'}, {'label': 'AC150', 'value': 'AC150'}, {'label': '9588 KOEN 2 - IP200 SD(INT. Earth fault)', 'value': '5001W00001UyP5wQAF'}, {'label': 'false', 'value': False}, {'label': 'true', 'value': True}, {'label': 'AC150 random timer was burn.', 'value': 'AC150 random timer was burn.'}, {'label': '9588 KOEN 2 - IP200 SD(INT. Earth fault)', 'value': '9588 KOEN 2 - IP200 SD(INT. Earth fault)'}]}, {'dataCells': [{'label': '5/4/2019 7:10 PM', 'value': '2019-05-04T23:10:00Z'}, {'label': 'Jaejoo Lim', 'value': '005400000033InGAAU'}, {'label': 'PureCell 400 - 10011', 'value': 'a0T40000005Nku6EAC'}, {'label': '00068411', 'value': '5001W00001UyOmfQAF'}, {'label': 'IP200 - Any PCS (Inverter) Shutdown', 'value': 'IP200 - Any PCS (Inverter) Shutdown'}, {'label': 'Outage', 'value': 'Outage'}, {'label': 'Powerplant Induced Shutdown', 'value': 'Powerplant Induced Shutdown'}, {'label': '9,756', 'value': 9756}, {'label': '5/5/2019 6:36 AM', 'value': '2019-05-05T10:36:00Z'}, {'label': '-', 'value': None}, {'label': '10011 EWP - IP200 SD(INV Breaker Fault)', 'value': '5001W00001UyOmfQAF'}, {'label': 'true', 'value': True}, {'label': 'false', 'value': False}, {'label': 'Changed RTU timeout to 5s.', 'value': 'Changed RTU timeout to 5s.'}, {'label': '10011 EWP - IP200 SD(INV Breaker Fault)\r\n\r\n* The first fault was RTU comm fault.', 'value': '10011 EWP - IP200 SD(INV Breaker Fault)\r\n\r\n* The first fault was RTU comm fault.'}]}, {'dataCells': [{'label': '5/4/2019 11:24 AM', 'value': '2019-05-04T15:24:00Z'}, {'label': 'Kyounghoon Cho', 'value': '0054000000476RSAAY'}, {'label': 'PureCell 400 - 9592', 'value': 'a0T40000001ltFFEAY'}, {'label': '00068404', 'value': '5001W00001UyOFMQA3'}, {'label': 'IP200 - Any PCS (Inverter) Shutdown', 'value': 'IP200 - Any PCS (Inverter) Shutdown'}, {'label': 'Outage', 'value': 'Outage'}, {'label': 'Powerplant Induced Shutdown', 'value': 'Powerplant Induced Shutdown'}, {'label': '17,650', 'value': 17650}, {'label': '5/7/2019 4:24 AM', 'value': '2019-05-07T08:24:00Z'}, {'label': 'AC150', 'value': 'AC150'}, {'label': '9592 Lotte - IP200 SD (ON BOARD TEMP FAULT)', 'value': '5001W00001UyOFMQA3'}, {'label': 'true', 'value': True}, {'label': 'false', 'value': False}, {'label': 'AC150 was shut down due to high temp of room', 'value': 'AC150 was shut down due to high temp of room'}, {'label': '9592 Lotte - IP200 SD (ON BOARD TEMP FAULT)', 'value': '9592 Lotte - IP200 SD (ON BOARD TEMP FAULT)'}]}, {'dataCells': [{'label': '5/4/2019 10:35 AM', 'value': '2019-05-04T14:35:00Z'}, {'label': 'Jaejoo Lim', 'value': '005400000033InGAAU'}, {'label': 'PureCell 400 - 9794', 'value': 'a0T40000004TyYSEA0'}, {'label': '00068402', 'value': '5001W00001UyO7OQAV'}, {'label': 'TE012FT - Reformer Tube Temperature  Fault Tolerant Output', 'value': 'TE012FT - Reformer Tube Temperature  Fault Tolerant Output'}, {'label': 'Failed Start', 'value': 'Failed Start'}, {'label': 'Powerplant Induced Shutdown', 'value': 'Powerplant Induced Shutdown'}, {'label': '15,891', 'value': 15891}, {'label': '5/7/2019 5:58 AM', 'value': '2019-05-07T09:58:00Z'}, {'label': '-', 'value': None}, {'label': '9794 Baegot - TE012FT SD', 'value': '5001W00001UyO7OQAV'}, {'label': 'true', 'value': True}, {'label': 'false', 'value': False}, {'label': '-', 'value': None}, {'label': '9794 Baegot - TE012FT SD', 'value': '9794 Baegot - TE012FT SD'}]}, {'dataCells': [{'label': '5/4/2019 8:43 AM', 'value': '2019-05-04T12:43:00Z'}, {'label': 'Hyemi Ahn', 'value': '0051W0000056xYiQAI'}, {'label': 'PureCell 400 - 10040', 'value': 'a0T40000005NkuZEAS'}, {'label': '00068401', 'value': '5001W00001UyNyfQAF'}, {'label': 'FT140 - Burner Air Flow Transmitter', 'value': 'FT140 - Burner Air Flow Transmitter'}, {'label': 'Failed Start', 'value': 'Failed Start'}, {'label': 'Powerplant Induced Shutdown', 'value': 'Powerplant Induced Shutdown'}, {'label': '5,427', 'value': 5427}, {'label': '5/6/2019 11:22 PM', 'value': '2019-05-07T03:22:00Z'}, {'label': '-', 'value': None}, {'label': '10040 KOEN 4 - FT140 SD', 'value': '5001W00001UyNyfQAF'}, {'label': 'true', 'value': True}, {'label': 'false', 'value': False}, {'label': '-', 'value': None}, {'label': '10040 KOEN 4 - FT140 SD', 'value': '10040 KOEN 4 - FT140 SD'}]}, {'dataCells': [{'label': '5/4/2019 4:17 AM', 'value': '2019-05-04T08:17:00Z'}, {'label': 'Boram Kim', 'value': '0051W000004MOkdQAG'}, {'label': 'PureCell 400 - 10150', 'value': 'a0T1W000005PfktUAC'}, {'label': '00068460', 'value': '5001W00001UyYIxQAN'}, {'label': 'BC_SD - Burner Controller Shutdown', 'value': 'BC_SD - Burner Controller Shutdown'}, {'label': 'Outage', 'value': 'Outage'}, {'label': 'Powerplant Induced Shutdown', 'value': 'Powerplant Induced Shutdown'}, {'label': '1,099', 'value': 1099}, {'label': '5/7/2019 3:21 AM', 'value': '2019-05-07T07:21:00Z'}, {'label': '-', 'value': None}, {'label': '10150 West Power 3 - BC SD', 'value': '5001W00001UyYIxQAN'}, {'label': 'true', 'value': True}, {'label': 'false', 'value': False}, {'label': '-', 'value': None}, {'label': '10150 West Power 3 - BC SD', 'value': '10150 West Power 3 - BC SD'}]}, {'dataCells': [{'label': '5/3/2019 11:02 PM', 'value': '2019-05-04T03:02:00Z'}, {'label': 'Hyemi Ahn', 'value': '0051W0000056xYiQAI'}, {'label': 'PureCell 400 - 10002', 'value': 'a0T40000005NktxEAC'}, {'label': '00068390', 'value': '5001W00001UyNJDQA3'}, {'label': 'CV000_STATUS - Fuel Valve Feedback', 'value': 'CV000_STATUS - Fuel Valve Feedback'}, {'label': 'Failed Start', 'value': 'Failed Start'}, {'label': 'Powerplant Induced Shutdown', 'value': 'Powerplant Induced Shutdown'}, {'label': '6,829', 'value': 6829}, {'label': '5/7/2019 2:15 AM', 'value': '2019-05-07T06:15:00Z'}, {'label': 'New (please add description in comments)', 'value': 'New (please add description in comments)'}, {'label': '10002 KOEN 4 - CV000 SD', 'value': '5001W00001UyNJDQA3'}, {'label': 'false', 'value': False}, {'label': 'true', 'value': True}, {'label': "INVVAC_AB,BC,CA=0, GridVAC_AB,BC,CA=0. VSD140 curr was low so CV000(BC code 'A') occurred. Replaced GDM.", 'value': "INVVAC_AB,BC,CA=0, GridVAC_AB,BC,CA=0. VSD140 curr was low so CV000(BC code 'A') occurred. Replaced GDM."}, {'label': '10002 KOEN 4 - CV000 SD', 'value': '10002 KOEN 4 - CV000 SD'}]}, {'dataCells': [{'label': '5/3/2019 10:41 PM', 'value': '2019-05-04T02:41:00Z'}, {'label': 'Hyemi Ahn', 'value': '0051W0000056xYiQAI'}, {'label': 'PureCell 400 - 10040', 'value': 'a0T40000005NkuZEAS'}, {'label': '00068389', 'value': '5001W00001UyNHWQA3'}, {'label': 'CV000_STATUS - Fuel Valve Feedback', 'value': 'CV000_STATUS - Fuel Valve Feedback'}, {'label': 'Failed Start', 'value': 'Failed Start'}, {'label': 'Powerplant Induced Shutdown', 'value': 'Powerplant Induced Shutdown'}, {'label': '5,427', 'value': 5427}, {'label': '5/4/2019 8:43 AM', 'value': '2019-05-04T12:43:00Z'}, {'label': '-', 'value': None}, {'label': '10040 KOEN 4 - CV000SD', 'value': '5001W00001UyNHWQA3'}, {'label': 'true', 'value': True}, {'label': 'false', 'value': False}, {'label': '-', 'value': None}, {'label': '10040 KOEN 4 - CV000SD', 'value': '10040 KOEN 4 - CV000SD'}]}, {'dataCells': [{'label': '5/3/2019 7:45 PM', 'value': '2019-05-03T23:45:00Z'}, {'label': 'Viswa Musunuri', 'value': '0051W000005UzovQAC'}, {'label': 'PureCell 400 - 9595', 'value': 'a0T40000001ltFIEAY'}, {'label': '00068377', 'value': '5001W00001UyNBsQAN'}, {'label': '<Shutdown> - Shutdown from Operations Display (ET)', 'value': '<Shutdown> - Shutdown from Operations Display (ET)'}, {'label': 'Outage', 'value': 'Outage'}, {'label': 'Powerplant Induced Shutdown', 'value': 'Powerplant Induced Shutdown'}, {'label': '45,327', 'value': 45327}, {'label': '-', 'value': None}, {'label': '-', 'value': None}, {'label': '9595 Verizon WS - Manual SD', 'value': '5001W00001UyNBsQAN'}, {'label': 'true', 'value': True}, {'label': 'false', 'value': False}, {'label': '-', 'value': None}, {'label': '9595 Verizon WS - Manual SD', 'value': '9595 Verizon WS - Manual SD'}]}, {'dataCells': [{'label': '5/3/2019 4:54 PM', 'value': '2019-05-03T20:54:00Z'}, {'label': 'Seungwoo Song', 'value': '0051W000004WiqaQAC'}, {'label': 'PureCell 400 - 10160', 'value': 'a0T1W000005tN1IUAU'}, {'label': '00068373', 'value': '5001W00001UyMEbQAN'}, {'label': 'LOR_STATUS (Note 7) - ECS Lockout Relay Status Signal', 'value': 'LOR_STATUS (Note 7) - ECS Lockout Relay Status Signal'}, {'label': 'Outage', 'value': 'Outage'}, {'label': 'Powerplant Induced Shutdown', 'value': 'Powerplant Induced Shutdown'}, {'label': '1,237', 'value': 1237}, {'label': '5/10/2019 2:00 AM', 'value': '2019-05-10T06:00:00Z'}, {'label': '-', 'value': None}, {'label': '10160 West Power 3 - LOR SD', 'value': '5001W00001UyMEbQAN'}, {'label': 'true', 'value': True}, {'label': 'false', 'value': False}, {'label': '-', 'value': None}, {'label': '10160 West Power 3 - LOR SD', 'value': '10160 West Power 3 - LOR SD'}]}, {'dataCells': [{'label': '5/3/2019 12:18 PM', 'value': '2019-05-03T16:18:00Z'}, {'label': 'Jaejoo Lim', 'value': '005400000033InGAAU'}, {'label': 'PureCell 400 - 9791', 'value': 'a0T40000004TyYPEA0'}, {'label': '00068366', 'value': '5001W00001UyJgXQAV'}, {'label': 'LT400 - Separator Level Transmitter', 'value': 'LT400 - Separator Level Transmitter'}, {'label': 'Outage', 'value': 'Outage'}, {'label': 'Powerplant Induced Shutdown', 'value': 'Powerplant Induced Shutdown'}, {'label': '15,649', 'value': 15649}, {'label': '5/7/2019 1:26 AM', 'value': '2019-05-07T05:26:00Z'}, {'label': '-', 'value': None}, {'label': '9791 Baegot - LT400 SD', 'value': '5001W00001UyJgXQAV'}, {'label': 'true', 'value': True}, {'label': 'false', 'value': False}, {'label': '-', 'value': None}, {'label': '9791 Baegot - LT400 SD', 'value': '9791 Baegot - LT400 SD'}]}, {'dataCells': [{'label': '5/3/2019 8:30 AM', 'value': '2019-05-03T12:30:00Z'}, {'label': 'Justin Reynolds', 'value': '00540000001d3HZAAY'}, {'label': 'PureCell 400 - 9542', 'value': 'a0T40000001cWPEEA2'}, {'label': '00068359', 'value': '5001W00001UyHIYQA3'}, {'label': '<NORMAL_SHUTDOWN> - Normal Shutdown Signal from LOI', 'value': '<NORMAL_SHUTDOWN> - Normal Shutdown Signal from LOI'}, {'label': 'Failed Start', 'value': 'Failed Start'}, {'label': 'Powerplant Induced Shutdown', 'value': 'Powerplant Induced Shutdown'}, {'label': '46,263', 'value': 46263}, {'label': '-', 'value': None}, {'label': 'CSA - Multiple SS < 1V', 'value': 'CSA - Multiple SS < 1V'}, {'label': '9542 Coca Cola -- Manual SD', 'value': '5001W00001UyHIYQA3'}, {'label': 'true', 'value': True}, {'label': 'false', 'value': False}, {'label': 'See WO-00075834 for stack repalcement.\r\nCSA 10 was negative during last SVMs in idle at 5.3.19.', 'value': 'See WO-00075834 for stack repalcement.\r\nCSA 10 was negative during last SVMs in idle at 5.3.19.'}, {'label': '9542 Coca Cola -- Manual SD', 'value': '9542 Coca Cola -- Manual SD'}]}, {'dataCells': [{'label': '5/3/2019 7:48 AM', 'value': '2019-05-03T11:48:00Z'}, {'label': 'Hyemi Ahn', 'value': '0051W0000056xYiQAI'}, {'label': 'PureCell 400 - 10040', 'value': 'a0T40000005NkuZEAS'}, {'label': '00068358', 'value': '5001W00001UyH6SQAV'}, {'label': 'FT140 - Burner Air Flow Transmitter', 'value': 'FT140 - Burner Air Flow Transmitter'}, {'label': 'Failed Start', 'value': 'Failed Start'}, {'label': 'Powerplant Induced Shutdown', 'value': 'Powerplant Induced Shutdown'}, {'label': '5,426', 'value': 5426}, {'label': '5/3/2019 10:41 PM', 'value': '2019-05-04T02:41:00Z'}, {'label': '-', 'value': None}, {'label': '10040 KOEN 4 - FT140 SD', 'value': '5001W00001UyH6SQAV'}, {'label': 'true', 'value': True}, {'label': 'false', 'value': False}, {'label': '-', 'value': None}, {'label': '10040 KOEN 4 - FT140 SD', 'value': '10040 KOEN 4 - FT140 SD'}]}, {'dataCells': [{'label': '5/3/2019 6:25 AM', 'value': '2019-05-03T10:25:00Z'}, {'label': 'Boram Kim', 'value': '0051W000004MOkdQAG'}, {'label': 'PureCell 400 - 10184', 'value': 'a0T1W000005tN1gUAE'}, {'label': '00068356', 'value': '5001W00001UyGm8QAF'}, {'label': 'IP200 - Any PCS (Inverter) Shutdown', 'value': 'IP200 - Any PCS (Inverter) Shutdown'}, {'label': 'Outage', 'value': 'Outage'}, {'label': 'Powerplant Induced Shutdown', 'value': 'Powerplant Induced Shutdown'}, {'label': '1,584', 'value': 1584}, {'label': '5/8/2019 5:14 AM', 'value': '2019-05-08T09:14:00Z'}, {'label': '-', 'value': None}, {'label': '10184 West Power 3 - IP200 SD(DC Diode over temp)', 'value': '5001W00001UyGm8QAF'}, {'label': 'true', 'value': True}, {'label': 'false', 'value': False}, {'label': '-', 'value': None}, {'label': '10184 West Power 3 - IP200 SD(DC Diode over temp)', 'value': '10184 West Power 3 - IP200 SD(DC Diode over temp)'}]}, {'dataCells': [{'label': '5/3/2019 5:16 AM', 'value': '2019-05-03T09:16:00Z'}, {'label': 'Hyemi Ahn', 'value': '0051W0000056xYiQAI'}, {'label': 'PureCell 400 - 10002', 'value': 'a0T40000005NktxEAC'}, {'label': '00068355', 'value': '5001W00001UyGS8QAN'}, {'label': 'CV000_STATUS - Fuel Valve Feedback', 'value': 'CV000_STATUS - Fuel Valve Feedback'}, {'label': 'Failed Start', 'value': 'Failed Start'}, {'label': 'Powerplant Induced Shutdown', 'value': 'Powerplant Induced Shutdown'}, {'label': '6,829', 'value': 6829}, {'label': '-', 'value': None}, {'label': 'New (please add description in comments)', 'value': 'New (please add description in comments)'}, {'label': '10002 KOEN 4 - CV000 SD', 'value': '5001W00001UyGS8QAN'}, {'label': 'true', 'value': True}, {'label': 'false', 'value': False}, {'label': "INVVAC_AB,BC,CA=0, GridVAC_AB,BC,CA=0. VSD140 curr was low so CV000(BC code 'A') occurred. Replaced GDM.", 'value': "INVVAC_AB,BC,CA=0, GridVAC_AB,BC,CA=0. VSD140 curr was low so CV000(BC code 'A') occurred. Replaced GDM."}, {'label': '10002 KOEN 4 - CV000 SD', 'value': '10002 KOEN 4 - CV000 SD'}]}, {'dataCells': [{'label': '5/3/2019 5:12 AM', 'value': '2019-05-03T09:12:00Z'}, {'label': 'Kyounghoon Cho', 'value': '0054000000476RSAAY'}, {'label': 'PureCell 400 - 10130', 'value': 'a0T1W000005PTVjUAO'}, {'label': '00068354', 'value': '5001W00001UyGRFQA3'}, {'label': 'LOR_STATUS (Note 7) - ECS Lockout Relay Status Signal', 'value': 'LOR_STATUS (Note 7) - ECS Lockout Relay Status Signal'}, {'label': 'Outage', 'value': 'Outage'}, {'label': 'Powerplant Induced Shutdown', 'value': 'Powerplant Induced Shutdown'}, {'label': '3,973', 'value': 3973}, {'label': '5/4/2019 4:14 AM', 'value': '2019-05-04T08:14:00Z'}, {'label': '-', 'value': None}, {'label': '10130 KDHC - LORelay SD', 'value': '5001W00001UyGRFQA3'}, {'label': 'true', 'value': True}, {'label': 'false', 'value': False}, {'label': '-', 'value': None}, {'label': '10130 KDHC - LORelay SD', 'value': '10130 KDHC - LORelay SD'}]}, {'dataCells': [{'label': '5/3/2019 3:56 AM', 'value': '2019-05-03T07:56:00Z'}, {'label': 'Mooseung Choi', 'value': '0051W0000056xYsQAI'}, {'label': 'PureCell 400 - 9514', 'value': 'a0T40000001cWPqEAM'}, {'label': '00068349', 'value': '5001W00001UyG5YQAV'}, {'label': 'IP200 - Any PCS (Inverter) Shutdown', 'value': 'IP200 - Any PCS (Inverter) Shutdown'}, {'label': 'Outage', 'value': 'Outage'}, {'label': 'Powerplant Induced Shutdown', 'value': 'Powerplant Induced Shutdown'}, {'label': '45,827', 'value': 45827}, {'label': '5/7/2019 11:30 AM', 'value': '2019-05-07T15:30:00Z'}, {'label': '-', 'value': None}, {'label': '9514 GS Power - IP200 SD(MOVE Fuse Fault)', 'value': '5001W00001UyG5YQAV'}, {'label': 'true', 'value': True}, {'label': 'false', 'value': False}, {'label': '-', 'value': None}, {'label': '9514 GS Power - IP200 SD(MOVE Fuse Fault)', 'value': '9514 GS Power - IP200 SD(MOVE Fuse Fault)'}]}, {'dataCells': [{'label': '5/3/2019 3:56 AM', 'value': '2019-05-03T07:56:00Z'}, {'label': 'Mooseung Choi', 'value': '0051W0000056xYsQAI'}, {'label': 'PureCell 400 - 9512', 'value': 'a0T40000001cWOqEAM'}, {'label': '00068347', 'value': '5001W00001UyG59QAF'}, {'label': 'IP200 - Any PCS (Inverter) Shutdown', 'value': 'IP200 - Any PCS (Inverter) Shutdown'}, {'label': 'Outage', 'value': 'Outage'}, {'label': 'Powerplant Induced Shutdown', 'value': 'Powerplant Induced Shutdown'}, {'label': '68,088', 'value': 68088}, {'label': '5/4/2019 7:48 AM', 'value': '2019-05-04T11:48:00Z'}, {'label': 'SA001', 'value': 'SA001'}, {'label': '9512 GS Power - IP200 SD(MOVE Fuse Fault)', 'value': '5001W00001UyG59QAF'}, {'label': 'false', 'value': False}, {'label': 'true', 'value': True}, {'label': 'replace SA001', 'value': 'replace SA001'}, {'label': '9512 GS Power - IP200 SD(MOVE Fuse Fault)', 'value': '9512 GS Power - IP200 SD(MOVE Fuse Fault)'}]}, {'dataCells': [{'label': '5/3/2019 3:56 AM', 'value': '2019-05-03T07:56:00Z'}, {'label': 'Mooseung Choi', 'value': '0051W0000056xYsQAI'}, {'label': 'PureCell 400 - 9513', 'value': 'a0T40000001cWPtEAM'}, {'label': '00068348', 'value': '5001W00001UyG5JQAV'}, {'label': 'IP200 - Any PCS (Inverter) Shutdown', 'value': 'IP200 - Any PCS (Inverter) Shutdown'}, {'label': 'Outage', 'value': 'Outage'}, {'label': 'Powerplant Induced Shutdown', 'value': 'Powerplant Induced Shutdown'}, {'label': '74,134', 'value': 74134}, {'label': '5/9/2019 6:28 AM', 'value': '2019-05-09T10:28:00Z'}, {'label': '-', 'value': None}, {'label': '9513 GS Power - IP200 SD(MOVE Fuse Fault)', 'value': '5001W00001UyG5JQAV'}, {'label': 'true', 'value': True}, {'label': 'false', 'value': False}, {'label': '-', 'value': None}, {'label': '9513 GS Power - IP200 SD(MOVE Fuse Fault)', 'value': '9513 GS Power - IP200 SD(MOVE Fuse Fault)'}]}, {'dataCells': [{'label': '5/3/2019 3:56 AM', 'value': '2019-05-03T07:56:00Z'}, {'label': 'Mooseung Choi', 'value': '0051W0000056xYsQAI'}, {'label': 'PureCell 400 - 9509', 'value': 'a0T40000001cWPrEAM'}, {'label': '00068344', 'value': '5001W00001UyG3mQAF'}, {'label': 'IP200 - Any PCS (Inverter) Shutdown', 'value': 'IP200 - Any PCS (Inverter) Shutdown'}, {'label': 'Outage', 'value': 'Outage'}, {'label': 'Powerplant Induced Shutdown', 'value': 'Powerplant Induced Shutdown'}, {'label': '49,939', 'value': 49939}, {'label': '5/8/2019 9:45 AM', 'value': '2019-05-08T13:45:00Z'}, {'label': 'MOV Fuse', 'value': 'MOV Fuse'}, {'label': '9509 GS Power - IP200 SD(MOVE Fuse Fault)', 'value': '5001W00001UyG3mQAF'}, {'label': 'false', 'value': False}, {'label': 'true', 'value': True}, {'label': 'replace SA001', 'value': 'replace SA001'}, {'label': '9509 GS Power - IP200 SD(MOVE Fuse Fault)', 'value': '9509 GS Power - IP200 SD(MOVE Fuse Fault)'}]}, {'dataCells': [{'label': '5/3/2019 3:56 AM', 'value': '2019-05-03T07:56:00Z'}, {'label': 'Mooseung Choi', 'value': '0051W0000056xYsQAI'}, {'label': 'PureCell 400 - 9510', 'value': 'a0T40000001cWPpEAM'}, {'label': '00068345', 'value': '5001W00001UyG4GQAV'}, {'label': 'IP200 - Any PCS (Inverter) Shutdown', 'value': 'IP200 - Any PCS (Inverter) Shutdown'}, {'label': 'Outage', 'value': 'Outage'}, {'label': 'Powerplant Induced Shutdown', 'value': 'Powerplant Induced Shutdown'}, {'label': '1', 'value': 1}, {'label': '5/8/2019 2:13 AM', 'value': '2019-05-08T06:13:00Z'}, {'label': 'MOV Fuse', 'value': 'MOV Fuse'}, {'label': '9510 GS Power - IP200 SD(MOVE Fuse Fault)', 'value': '5001W00001UyG4GQAV'}, {'label': 'false', 'value': False}, {'label': 'true', 'value': True}, {'label': 'replace SA001\r\ncheck the megger at CSA', 'value': 'replace SA001\r\ncheck the megger at CSA